day,event,content,mental_state,personality
1,intent,Agent_18dda is preparing to fight the Entity.,calm,curious
1,rest,Agent_e7e63 took time to rest and feels more at peace.,calm,empathetic
1,dialogue,"Agent_e3113 talks with Agent_65c82: ""---""",N/A,N/A
1,dialogue,"Agent_007b6 talks with Agent_6f7e7: ""---""",N/A,N/A
1,dialogue,"Agent_dc6cb talks with Agent_ef8fa: ""Agent_dc6cb: I heard the Entity is going to come to our town soon. I'm so scared.""",N/A,N/A
1,intent,Agent_07080 is preparing to fight the Entity.,calm,brave
1,training,"Agent_ac126 trained in the village: +2 health, +1 attack, +1 defense.",determined,cautious
1,dialogue,"Agent_d1876 talks with Agent_b0cdc: ""Agent_d1876:
We are not going to let the Entity win.
We know the threat is real, and we are not going to hide in fear.
We must find a way to stop her.""",N/A,N/A
1,training,"Agent_fcca1 trained in the village: +1 health, +1 attack, +1 defense.",hopeful,curious
1,intent,Agent_da3ff is preparing to fight the Entity.,anxious,empathetic
1,training,"Agent_7077c trained in the village: +1 health, +1 attack, +0 defense.",hopeful,empathetic
1,rest,Agent_20512 took time to rest and feels more at peace.,calm,empathetic
1,intent,Agent_22c84 is preparing to fight the Entity.,anxious,curious
1,dialogue,"Agent_09019 talks with Agent_e3fcf: ""Agent_09019: ""I don't know if we can make it out of here alive. The Entity is getting closer every year.""""",N/A,N/A
1,rest,Agent_742b1 took time to rest and feels more at peace.,calm,curious
1,training,"Agent_b3042 trained in the village: +1 health, +0 attack, +1 defense.",hopeful,curious
1,training,"Agent_a1e8a trained in the village: +1 health, +0 attack, +1 defense.",determined,aggressive
1,training,"Agent_b0cdc trained in the village: +1 health, +0 attack, +0 defense.",hopeful,aggressive
1,intent,Agent_a35f9 is preparing to fight the Entity.,hopeful,curious
1,rest,Agent_6f7e7 took time to rest and feels more at peace.,calm,brave
1,intent,Agent_86364 is preparing to fight the Entity.,anxious,brave
1,rest,Agent_1164b took time to rest and feels more at peace.,calm,curious
1,intent,Agent_7d1ba is preparing to fight the Entity.,anxious,curious
1,training,"Agent_b32fa trained in the village: +1 health, +1 attack, +0 defense.",determined,cautious
1,intent,Agent_248d7 is preparing to fight the Entity.,determined,cautious
1,training,"Agent_9e158 trained in the village: +2 health, +0 attack, +0 defense.",hopeful,empathetic
1,training,"Agent_9953f trained in the village: +2 health, +0 attack, +1 defense.",hopeful,brave
1,training,"Agent_2ad13 trained in the village: +1 health, +1 attack, +1 defense.",hopeful,brave
1,intent,Agent_de986 is preparing to fight the Entity.,afraid,brave
1,intent,Agent_e957d is preparing to fight the Entity.,calm,cautious
1,intent,Agent_9f46d is preparing to fight the Entity.,determined,aggressive
1,rest,Agent_e3fcf took time to rest and feels more at peace.,determined,empathetic
1,rest,Agent_c39e9 took time to rest and feels more at peace.,hopeful,empathetic
1,training,"Agent_c44a6 trained in the village: +2 health, +1 attack, +0 defense.",determined,cautious
1,dialogue,"Agent_cdc70 talks with Agent_56048: ""Agent_cdc70: Agent_56048, have you seen the news lately?""",N/A,N/A
1,dialogue,"Agent_f5759 talks with Agent_a35f9: ""---""",N/A,N/A
1,training,"Agent_ef8fa trained in the village: +1 health, +0 attack, +0 defense.",calm,curious
1,rest,Agent_cca20 took time to rest and feels more at peace.,calm,curious
1,training,"Agent_ba26e trained in the village: +1 health, +1 attack, +0 defense.",determined,cautious
1,training,"Agent_19c44 trained in the village: +1 health, +1 attack, +0 defense.",determined,empathetic
1,training,"Agent_78e3e trained in the village: +2 health, +0 attack, +0 defense.",determined,cautious
1,training,"Agent_5f8a9 trained in the village: +2 health, +1 attack, +1 defense.",determined,curious
1,training,"Agent_bec91 trained in the village: +2 health, +1 attack, +0 defense.",determined,empathetic
1,training,"Agent_65c82 trained in the village: +2 health, +1 attack, +1 defense.",hopeful,brave
1,intent,Agent_56048 is preparing to fight the Entity.,hopeful,curious
1,pregnancy,Agent_742b1 got pregnant from Agent_cca20.,N/A,N/A
1,entity_attack,Entity killed Agent_07080 while defending herself.,N/A,N/A
1,travel_to_entity,"Agent_18dda traveled to the Entity: -8 HP, +9 days.",afraid,curious
1,travel_to_entity,"Agent_fcca1 traveled to the Entity: -9 HP, +10 days.",anxious,curious
1,travel_to_entity,"Agent_da3ff traveled to the Entity: -11 HP, +8 days.",afraid,empathetic
1,travel_to_entity,"Agent_7077c traveled to the Entity: -11 HP, +5 days.",afraid,empathetic
1,travel_to_entity,"Agent_20512 traveled to the Entity: -15 HP, +7 days.",anxious,empathetic
1,travel_to_entity,"Agent_b3042 traveled to the Entity: -10 HP, +8 days.",afraid,curious
1,travel_to_entity,"Agent_a35f9 traveled to the Entity: -5 HP, +5 days.",anxious,curious
1,travel_to_entity,"Agent_7d1ba traveled to the Entity: -10 HP, +8 days.",anxious,curious
1,travel_to_entity,"Agent_248d7 traveled to the Entity: -12 HP, +9 days.",anxious,cautious
1,travel_to_entity,"Agent_e3fcf traveled to the Entity: -13 HP, +8 days.",afraid,empathetic
1,travel_to_entity,"Agent_cdc70 traveled to the Entity: -9 HP, +6 days.",afraid,cautious
1,travel_to_entity,"Agent_f5759 traveled to the Entity: -7 HP, +5 days.",anxious,brave
1,travel_to_entity,"Agent_5f8a9 traveled to the Entity: -6 HP, +10 days.",afraid,curious
1,travel_to_entity,"Agent_bec91 traveled to the Entity: -13 HP, +6 days.",afraid,empathetic
1,travel_to_entity,"Agent_65c82 traveled to the Entity: -13 HP, +9 days.",anxious,brave
1,travel_to_entity,"Agent_56048 traveled to the Entity: -9 HP, +8 days.",afraid,curious
1,travel_to_entity,"Agent_814e6 traveled to the Entity: -8 HP, +8 days.",anxious,brave
1,entity_defense,Entity killed Agent_cdc70 while defending herself.,N/A,N/A
2,dialogue,"Agent_b0cdc talks with Agent_742b1: ""---""",afraid,aggressive
2,dialogue,"Agent_a1e8a talks with Agent_a35f9: ""Agent_a1e8a: (whispers) I am afraid of the Entity.""",afraid,aggressive
2,dialogue,"Agent_9953f talks with Agent_9f46d: ""---""",anxious,brave
2,dialogue,"Agent_56048 talks with Agent_b32fa: ""Agent_56048: Hey Agent_b32fa, have you heard anything about the Entity lately?""",determined,curious
2,dialogue,"Agent_e3fcf talks with Agent_f5759: ""---""",afraid,empathetic
2,dialogue,"Agent_d1876 talks with Agent_22c84: ""---""",anxious,brave
2,dialogue,"Agent_c73dd talks with Agent_d1876: ""Agent_c73dd: Hey, I've been thinking about our current situation. It's getting more and more dangerous every day.
Agent_d1876: I know, it's scary. But we have to keep going. We have to find a way to protect ourselves and the others.
Agent_c73dd: I agree. But we can't keep living like this forever. We need to find a way to survive.
Agent_d1876: I agree. We need to come up with a plan. A strategy. We need to think logically and strategically.
Agent_c73dd: I agree. We need to find a way to""",determined,cautious
2,dialogue,"Agent_78e3e talks with Agent_c39e9: ""Agent_c39e9: ""I don't know what's gonna happen tomorrow. The Entity is getting closer and closer, and I can feel the fear building up inside me.""""",afraid,cautious
2,dialogue,"Agent_e957d talks with Agent_dc6cb: ""---""",anxious,cautious
2,dialogue,"Agent_22c84 talks with Agent_65c82: ""Agent_22c84: Hello Agent_65c82, how's it going?
Agent_65c82: Not great, Agent_22c84. It's been a while since we last spoke, and the situation has worsened. The Entity is now targeting people who are only 99 years old, and we're all running out of time.
Agent_22c84: I know, it's scary. But we have to keep going. We can't give up hope.
Agent_65c82: I agree, but what are we going to do? We're just two people, and""",anxious,curious
2,dialogue,"Agent_1164b talks with Agent_65c82: ""Agent_1164b: ""Hey Agent_65c82, do you think the Entity is still out there?""
Agent_65c82: ""Yes, Agent_1164b, we have to assume that she's still out there. But we'll do everything we can to protect ourselves and our town. We'll keep an eye on the age threshold and make sure we don't get caught in the crossfire.""
Agent_1164b: ""But what if we don't make it? What if we're killed by the Entity?""
Agent_65c82: ""We won't give up hope""",anxious,curious
2,dialogue,"Agent_ba26e talks with Agent_c39e9: ""---""",afraid,cautious
2,dialogue,"Agent_b32fa talks with Agent_c44a6: ""Agent_b32fa: ""I'm worried. The Entity is coming for us. We need to come up with a plan.""""",anxious,cautious
2,dialogue,"Agent_c39e9 talks with Agent_d1876: ""Agent_c39e9: I was thinking about the Entity and how close we are to the deadline. It's scary to think about losing everything we know and love.""",determined,empathetic
2,dialogue,"Agent_a35f9 talks with Agent_e3113: ""Agent_a35f9: ""I'm so glad you're here. I'm starting to feel like I'm going crazy. Every day I try to grow more crops, but the Entity is just waiting for us to turn 100. I'm so scared of losing everything.""
Agent_e3113: ""I know it's hard, but we can't let fear control us. We need to focus on what we can do to survive. I've been thinking a lot about it, and I believe we should start by gathering as much food as possible. We can store it in a secure place and ration it out until we figure out a way to""",hopeful,curious
2,dialogue,"Agent_20512 talks with Agent_c73dd: ""---""",anxious,empathetic
2,dialogue,"Agent_dc6cb talks with Agent_78e3e: ""Agent_dc6cb: ""What's happening in the world outside? I'm scared of the Entity.""""",afraid,curious
2,dialogue,"Agent_ef8fa talks with Agent_e957d: ""---""",afraid,curious
2,dialogue,"Agent_86364 talks with Agent_e7e63: ""---""",afraid,brave
2,dialogue,"Agent_19c44 talks with Agent_9f46d: ""Agent_19c44: ""I heard the Entity is getting closer. I'm so afraid. I don't know what we're going to do.""""",afraid,empathetic
2,dialogue,"Agent_cd3a2 talks with Agent_7d1ba: ""---""",anxious,curious
2,dialogue,"Agent_9f46d talks with Agent_a35f9: ""Agent_9f46d: Hey, I'm Agent_9f46d. Nice to meet you.
Agent_a35f9: Nice to meet you too. I'm Agent_a35f9.""",hopeful,aggressive
2,dialogue,"Agent_3d10e talks with Agent_b0cdc: ""Agent_3d10e: We should go on patrol tonight. The Entity is getting closer, and we need to keep an eye out for anyone suspicious.""",anxious,cautious
2,dialogue,"Agent_09019 talks with Agent_1164b: ""---""",anxious,aggressive
2,dialogue,"Agent_e3113 talks with Agent_56048: ""---""",hopeful,curious
2,dialogue,"Agent_9e158 talks with Agent_86364: ""---""",anxious,empathetic
2,dialogue,"Agent_ac126 talks with Agent_9953f: ""---""",anxious,cautious
2,dialogue,"Agent_de986 talks with Agent_22c84: ""---""",determined,brave
2,dialogue,"Agent_cca20 talks with Agent_bec91: ""Agent_cca20: Hey Agent_bec91, how's it going?
Agent_bec91: It's going bad, Agent_cca20. The Entity is getting closer and closer.
Agent_cca20: Yeah, I've been thinking about what we should do.
Agent_bec91: I agree. We need to find a way to survive.
Agent_cca20: I'm worried about being caught. I don't want to be erased.
Agent_bec91: Me too, Agent_cca20. But we have to keep going.
Agent_cca20: I know, but I don't""",anxious,curious
2,dialogue,"Agent_65c82 talks with Agent_78e3e: ""---""",afraid,brave
2,dialogue,"Agent_fcca1 talks with Agent_22c84: ""Agent_fcca1: ""It's already getting harder to find people who are 100 years old. What if the Entity just keeps going and we don't find any more? We won't even have any teachers left. We have to come up with a plan. We need to figure out a way to survive.""""",afraid,curious
2,dialogue,"Agent_86853 talks with Agent_2ad13: ""---""",afraid,brave
2,dialogue,"Agent_c44a6 talks with Agent_b32fa: ""Agent_c44a6: ""It's been a year since we were assigned to this mission, but the Entity is still out there. I'm starting to lose hope.""""",anxious,cautious
2,dialogue,"Agent_18dda talks with Agent_a1e8a: ""Agent_18dda: Hey, Agent_a1e8a. How's it going?
Agent_a1e8a: It's going okay. We're just trying to survive until the Entity stops erasing people.
Agent_18dda: Yeah, I know. It's getting harder and harder to keep up with the changing age threshold.
Agent_a1e8a: I'm really scared, Agent_18dda. I don't know what we can do to stop the Entity.
Agent_18dda: We need to find a way to protect ourselves. Maybe we can find a way to reverse the P""",afraid,curious
2,dialogue,"Agent_f5759 talks with Agent_b0cdc: ""Agent_f5759: Hey, I'm Agent_f5759. I've been assigned to work with you.""",anxious,brave
2,dialogue,"Agent_b3042 talks with Agent_56048: ""---""",determined,curious
2,dialogue,"Agent_e7e63 talks with Agent_ba26e: ""---""",afraid,empathetic
2,dialogue,"Agent_bec91 talks with Agent_742b1: ""---""",afraid,empathetic
2,dialogue,"Agent_5f8a9 talks with Agent_cd3a2: ""---""",anxious,curious
2,dialogue,"Agent_007b6 talks with Agent_b32fa: ""Agent_007b6: I'm glad you're here. It's been a while since we last talked.""",determined,cautious
2,dialogue,"Agent_6f7e7 talks with Agent_1164b: ""---""",anxious,brave
2,dialogue,"Agent_248d7 talks with Agent_e3113: ""---""",hopeful,cautious
2,dialogue,"Agent_da3ff talks with Agent_22c84: ""---""",afraid,empathetic
2,dialogue,"Agent_7077c talks with Agent_bec91: ""Agent_7077c: ""Hey, Agent_bec91. How are you doing? I'm Agent_7077c.""
Agent_bec91: ""Hi, Agent_7077c. I'm Agent_bec91. I'm doing my best to keep my head down and hope for the best.""
Agent_7077c: ""I know what you mean. It's hard not to feel afraid every time you look outside and see the Entity at work.""
Agent_bec91: ""Yeah, it's like every day is a race against time. But we have to keep going, right?""
Agent_7""",afraid,empathetic
2,dialogue,"Agent_2ad13 talks with Agent_c39e9: ""---""",anxious,brave
2,dialogue,"Agent_7d1ba talks with Agent_248d7: ""---""",hopeful,curious
2,dialogue,"Agent_814e6 talks with Agent_c44a6: ""---""",afraid,brave
2,dialogue,"Agent_742b1 talks with Agent_86364: ""Agent_742b1: Agent_86364, I can't believe we are both living in the same town.""",afraid,curious
2,intent,Agent_b0cdc is preparing to fight the Entity.,afraid,aggressive
2,dialogue,"Agent_a1e8a talks with Agent_86364: ""Agent_a1e8a: ""I'm afraid. I don't know what to do. The Entity is coming for us. I have no hope.""""",N/A,N/A
2,training,"Agent_9953f trained in the village: +2 health, +0 attack, +0 defense.",determined,brave
2,dialogue,"Agent_56048 talks with Agent_22c84: ""---""",N/A,N/A
2,training,"Agent_d1876 trained in the village: +2 health, +0 attack, +0 defense.",determined,brave
2,intent,Agent_c73dd is preparing to fight the Entity.,determined,cautious
2,training,"Agent_78e3e trained in the village: +2 health, +0 attack, +1 defense.",determined,cautious
2,intent,Agent_e957d is preparing to fight the Entity.,anxious,cautious
2,training,"Agent_22c84 trained in the village: +1 health, +1 attack, +1 defense.",determined,curious
2,dialogue,"Agent_1164b talks with Agent_742b1: ""---""",N/A,N/A
2,training,"Agent_ba26e trained in the village: +2 health, +1 attack, +1 defense.",determined,cautious
2,dialogue,"Agent_b32fa talks with Agent_b3042: ""Agent_b32fa: ""I'm not sure what to do anymore, I'm so worried about the Entity. I feel like I'm constantly counting down to my own death.""
Agent_b3042: ""I know how you feel, but I think we need to focus on survival. We can't let fear control us.""
Agent_b32fa: ""But what can we do? The Entity is so powerful, she could easily erase us all.""
Agent_b3042: ""We can't control what happens to us, but we can control how we react to it. Let's think about what we can do to stay""",N/A,N/A
2,intent,Agent_c39e9 is preparing to fight the Entity.,determined,empathetic
2,training,"Agent_a35f9 trained in the village: +2 health, +1 attack, +1 defense.",hopeful,curious
2,rest,Agent_20512 took time to rest and feels more at peace.,calm,empathetic
2,rest,Agent_dc6cb took time to rest and feels more at peace.,calm,curious
2,dialogue,"Agent_ef8fa talks with Agent_56048: ""Agent_ef8fa: ""I am so scared. I don't know what to do. I can't even think straight.""
Agent_56048: ""I know how you feel, Agent_ef8fa. But we need to be smart about this. We can't just sit here and wait for the Entity to come.""
Agent_ef8fa: ""Yes, but what can we do? We have no weapons, no power. We're just ordinary people.""
Agent_56048: ""We don't need weapons or power to survive. We have our skills and each other. We can use them to protect ourselves and our loved ones.""""",N/A,N/A
2,training,"Agent_86364 trained in the village: +1 health, +0 attack, +1 defense.",determined,brave
2,intent,Agent_19c44 is preparing to fight the Entity.,afraid,empathetic
2,dialogue,"Agent_cd3a2 talks with Agent_e7e63: ""Agent_cd3a2: ""Hey Agent_e7e63, have you heard about the Entity?""""",N/A,N/A
2,training,"Agent_9e158 trained in the village: +2 health, +0 attack, +0 defense.",determined,empathetic
2,training,"Agent_ac126 trained in the village: +2 health, +1 attack, +0 defense.",determined,cautious
2,training,"Agent_de986 trained in the village: +2 health, +0 attack, +0 defense.",determined,brave
2,intent,Agent_cca20 is preparing to fight the Entity.,anxious,curious
2,intent,Agent_65c82 is preparing to fight the Entity.,afraid,brave
2,intent,Agent_fcca1 is preparing to fight the Entity.,afraid,curious
2,training,"Agent_86853 trained in the village: +2 health, +1 attack, +0 defense.",determined,brave
2,training,"Agent_c44a6 trained in the village: +2 health, +1 attack, +1 defense.",determined,cautious
2,training,"Agent_18dda trained in the village: +1 health, +1 attack, +1 defense.",determined,curious
2,intent,Agent_f5759 is preparing to fight the Entity.,anxious,brave
2,intent,Agent_b3042 is preparing to fight the Entity.,determined,curious
2,training,"Agent_e7e63 trained in the village: +2 health, +0 attack, +1 defense.",determined,empathetic
2,training,"Agent_bec91 trained in the village: +2 health, +1 attack, +1 defense.",determined,empathetic
2,intent,Agent_5f8a9 is preparing to fight the Entity.,anxious,curious
2,intent,Agent_007b6 is preparing to fight the Entity.,determined,cautious
2,training,"Agent_6f7e7 trained in the village: +1 health, +1 attack, +0 defense.",determined,brave
2,training,"Agent_248d7 trained in the village: +2 health, +1 attack, +0 defense.",hopeful,cautious
2,intent,Agent_da3ff is preparing to fight the Entity.,afraid,empathetic
2,intent,Agent_7077c is preparing to fight the Entity.,afraid,empathetic
2,training,"Agent_2ad13 trained in the village: +1 health, +0 attack, +1 defense.",determined,brave
2,intent,Agent_7d1ba is preparing to fight the Entity.,hopeful,curious
2,intent,Agent_814e6 is preparing to fight the Entity.,afraid,brave
2,rest,Agent_742b1 took time to rest and feels more at peace.,calm,curious
2,pregnancy,Agent_f5759 got pregnant from Agent_da3ff.,N/A,N/A
2,entity_attack,Entity killed Agent_c39e9 while defending herself.,N/A,N/A
2,travel_to_entity,"Agent_56048 traveled to the Entity: -5 HP, +5 days.",afraid,curious
2,travel_to_entity,"Agent_22c84 traveled to the Entity: -15 HP, +8 days.",anxious,curious
2,travel_to_entity,"Agent_b32fa traveled to the Entity: -5 HP, +5 days.",afraid,cautious
2,travel_to_entity,"Agent_a35f9 traveled to the Entity: -14 HP, +7 days.",anxious,curious
2,travel_to_entity,"Agent_19c44 traveled to the Entity: -14 HP, +10 days.",anxious,empathetic
2,travel_to_entity,"Agent_9f46d traveled to the Entity: -11 HP, +9 days.",anxious,aggressive
2,travel_to_entity,"Agent_09019 traveled to the Entity: -15 HP, +10 days.",anxious,aggressive
2,travel_to_entity,"Agent_e3113 traveled to the Entity: -8 HP, +6 days.",afraid,curious
2,travel_to_entity,"Agent_de986 traveled to the Entity: -9 HP, +9 days.",afraid,brave
2,travel_to_entity,"Agent_65c82 traveled to the Entity: -10 HP, +8 days.",afraid,brave
2,travel_to_entity,"Agent_fcca1 traveled to the Entity: -9 HP, +9 days.",afraid,curious
2,travel_to_entity,"Agent_86853 traveled to the Entity: -7 HP, +7 days.",afraid,brave
2,travel_to_entity,"Agent_bec91 traveled to the Entity: -15 HP, +5 days.",anxious,empathetic
2,travel_to_entity,"Agent_da3ff traveled to the Entity: -13 HP, +9 days.",anxious,empathetic
2,entity_defense,Entity killed Agent_22c84 while defending herself.,N/A,N/A
3,dialogue,"Agent_c44a6 talks with Agent_cca20: ""Agent_c44a6: I hope you are okay, Agent_cca20.""",anxious,cautious
3,dialogue,"Agent_f5759 talks with Agent_b32fa: ""Agent_f5759: ""I heard the Entity is coming today. We need to get out of here.""""",afraid,brave
3,dialogue,"Agent_dc6cb talks with Agent_814e6: ""---""",afraid,curious
3,dialogue,"Agent_cca20 talks with Agent_ef8fa: ""Agent_cca20: Hey, Agent_ef8fa. How's it going?""",anxious,curious
3,dialogue,"Agent_007b6 talks with Agent_56048: ""Agent_007b6: ""Agent 56048, I've been thinking about the Entity lately. It's getting harder to ignore the possibility of our deaths.""""",anxious,cautious
3,dialogue,"Agent_7d1ba talks with Agent_e3fcf: ""Agent_7d1ba: Hey Agent_e3fcf, I'm really scared about the Entity. What if we don't make it?""",afraid,curious
3,dialogue,"Agent_b32fa talks with Agent_9953f: ""Agent_b32fa: ""I hope you're okay. I can't shake off this feeling of anxiety.""""",anxious,cautious
3,dialogue,"Agent_bec91 talks with Agent_c73dd: ""---""",anxious,empathetic
3,dialogue,"Agent_18dda talks with Agent_e7e63: ""Agent_18dda: I just heard the news about the Entity... it's so scary.
Agent_e7e63: I know, I've been keeping track of the deaths for years now.
Agent_18dda: But it's getting worse each year, we need to do something about it.
Agent_e7e63: I agree. We have to find a way to stop her.
Agent_18dda: But how? She's a powerful and dangerous force.
Agent_e7e63: We need to think about this logically. We have to find a way to survive and protect ourselves.
Agent_1""",anxious,curious
3,dialogue,"Agent_b0cdc talks with Agent_56048: ""Agent_b0cdc: (Anxious)
I can't believe this is happening. I don't even know what's happening.""",anxious,aggressive
3,dialogue,"Agent_9953f talks with Agent_814e6: ""---""",afraid,brave
3,dialogue,"Agent_9e158 talks with Agent_c73dd: ""Agent_9e158: ""I heard it's getting worse. We need to come up with a plan.""
Agent_c73dd: ""I agree. It's getting harder to hide. We need to think about long-term survival.""
Agent_9e158: ""We should start stocking up on food and supplies. We'll need them if the Entity finds us.""
Agent_c73dd: ""Good idea. We should also keep an eye on each other's mental state. It's important to support each other.""
Agent_9e158: ""I know. I've been feeling more scared lately. It's""",afraid,empathetic
3,dialogue,"Agent_d1876 talks with Agent_5f8a9: ""---""",afraid,brave
3,dialogue,"Agent_c73dd talks with Agent_5f8a9: ""Agent_c73dd:
""Agent 5f8a9, we must remain cautious. We don't know what the Entity will do next.""""",determined,cautious
3,dialogue,"Agent_814e6 talks with Agent_dc6cb: ""Agent_814e6: Hey Agent_dc6cb, I'm so glad we're both here. I feel like we're the only ones left who can do something about this Entity.""",afraid,brave
3,dialogue,"Agent_ef8fa talks with Agent_da3ff: ""---""",hopeful,curious
3,dialogue,"Agent_ac126 talks with Agent_ba26e: ""---""",hopeful,cautious
3,dialogue,"Agent_20512 talks with Agent_c73dd: ""Agent_20512: Hey c73dd, have you heard anything about the Entity?""",anxious,empathetic
3,dialogue,"Agent_a1e8a talks with Agent_9e158: ""Agent_a1e8a: Hi there, Agent_9e158. Are you okay?""",anxious,aggressive
3,dialogue,"Agent_e957d talks with Agent_9e158: ""Agent_e957d:
""Well, Agent_9e158. It's been a while since we last talked.""""",anxious,cautious
3,dialogue,"Agent_ba26e talks with Agent_19c44: ""---""",anxious,cautious
3,dialogue,"Agent_1164b talks with Agent_b0cdc: ""Agent_1164b: I'm so scared, Agent_b0cdc. I'm just a small farmer, and I don't know if I can survive the Entity's attack.
Agent_b0cdc: I know it's scary, but we have to stay strong. We can't give up hope.
Agent_1164b: What if we do? What if we can't find a way to stop the Entity?
Agent_b0cdc: We won't know until we try. We have to keep looking for a solution.
Agent_1164b: But what if we fail? What if""",afraid,curious
3,dialogue,"Agent_e3113 talks with Agent_9953f: ""Agent_e3113: 
I'm so afraid of the Entity. 
I feel like we're running out of time.
Every day I worry if I'll make it to the next one.
I don't know what to do.""",afraid,curious
3,dialogue,"Agent_56048 talks with Agent_e3113: ""---""",determined,curious
3,dialogue,"Agent_cd3a2 talks with Agent_a1e8a: ""Agent_cd3a2: ""I heard the Entity is coming closer. Are you scared too?""
Agent_a1e8a: ""Of course, but I don't let fear control me. I just keep running and hiding.""
Agent_cd3a2: ""I wish I knew what to do. I can't help but think we're doomed.""
Agent_a1e8a: ""We don't know for sure what will happen. But we can't give up hope. We have to keep moving and finding new hiding places.""
Agent_cd3a2: ""I don't know how much longer I can keep this up. I'm""",afraid,curious
3,dialogue,"Agent_e3fcf talks with Agent_814e6: ""---""",afraid,empathetic
3,dialogue,"Agent_de986 talks with Agent_18dda: ""---""",anxious,brave
3,dialogue,"Agent_da3ff talks with Agent_d1876: ""Agent_da3ff: Hey there, Agent_d1876. How's it going?""",anxious,empathetic
3,dialogue,"Agent_3d10e talks with Agent_9e158: ""Agent_3d10e: Agent_9e158, I don't know if I can trust you.
Agent_9e158: Why not?
Agent_3d10e: I mean, we're strangers.
Agent_9e158: I understand your concerns, but I am here to help you.
Agent_3d10e: But what if you're just trying to lure me into a trap?
Agent_9e158: That's not what I want. I just want to help you survive.
Agent_3d10e: Okay, but how do I know we can trust each other?""",determined,cautious
3,dialogue,"Agent_65c82 talks with Agent_742b1: ""Agent_65c82:
I'm so afraid.""",afraid,brave
