day,event,content,mental_state,personality
5,intent,Agent_c73dd is preparing to fight the Entity.,afraid,cautious
5,dialogue,"Agent_09019 talks with Agent_7077c: ""---""",N/A,N/A
5,dialogue,"Agent_9f46d talks with Agent_f5759: ""---""",N/A,N/A
5,dialogue,"Agent_78e3e talks with Agent_f5759: ""Agent_78e3e: Agent_f5759, I'm so afraid. The Entity is coming for us.""",N/A,N/A
5,training,"Agent_86853 trained in the village: +1 health, +0 attack, +1 defense.",determined,brave
5,training,"Agent_9e158 trained in the village: +2 health, +1 attack, +1 defense.",determined,empathetic
5,intent,Agent_c44a6 is preparing to fight the Entity.,afraid,cautious
5,training,"Agent_e7e63 trained in the village: +1 health, +1 attack, +0 defense.",determined,empathetic
5,rest,Agent_dc6cb took time to rest and feels more at peace.,calm,curious
5,rest,Agent_1164b took time to rest and feels more at peace.,calm,curious
5,training,"Agent_b3042 trained in the village: +2 health, +1 attack, +1 defense.",determined,curious
5,dialogue,"Agent_e3113 talks with Agent_1164b: ""---""",N/A,N/A
5,training,"Agent_18dda trained in the village: +1 health, +1 attack, +0 defense.",determined,curious
5,training,"Agent_5f8a9 trained in the village: +2 health, +0 attack, +1 defense.",determined,curious
5,training,"Agent_d1876 trained in the village: +1 health, +1 attack, +1 defense.",determined,brave
5,training,"Agent_20512 trained in the village: +1 health, +1 attack, +1 defense.",determined,empathetic
5,intent,Agent_de986 is preparing to fight the Entity.,afraid,brave
5,intent,Agent_56048 is preparing to fight the Entity.,anxious,curious
5,training,"Agent_2ad13 trained in the village: +1 health, +0 attack, +1 defense.",determined,brave
5,training,"Agent_a1e8a trained in the village: +2 health, +0 attack, +0 defense.",determined,aggressive
5,training,"Agent_814e6 trained in the village: +2 health, +0 attack, +1 defense.",determined,brave
5,training,"Agent_ac126 trained in the village: +2 health, +0 attack, +0 defense.",determined,cautious
5,rest,Agent_e3fcf took time to rest and feels more at peace.,determined,empathetic
5,intent,Agent_19c44 is preparing to fight the Entity.,afraid,empathetic
5,training,"Agent_007b6 trained in the village: +2 health, +0 attack, +1 defense.",determined,cautious
5,training,"Agent_f5759 trained in the village: +1 health, +0 attack, +1 defense.",hopeful,brave
5,training,"Agent_b0cdc trained in the village: +1 health, +1 attack, +0 defense.",determined,aggressive
5,training,"Agent_cd3a2 trained in the village: +1 health, +1 attack, +1 defense.",determined,curious
5,intent,Agent_7077c is preparing to fight the Entity.,afraid,empathetic
5,rest,Agent_6f7e7 took time to rest and feels more at peace.,calm,brave
5,training,"Agent_65c82 trained in the village: +1 health, +0 attack, +0 defense.",determined,brave
5,training,"Agent_bec91 trained in the village: +2 health, +1 attack, +1 defense.",determined,empathetic
5,training,"Agent_742b1 trained in the village: +2 health, +1 attack, +0 defense.",determined,curious
5,intent,Agent_7d1ba is preparing to fight the Entity.,determined,curious
5,intent,Agent_248d7 is preparing to fight the Entity.,afraid,cautious
5,pregnancy,Agent_9f46d got pregnant from Agent_20512.,N/A,N/A
5,entity_attack,Entity killed Agent_9f46d while defending herself.,N/A,N/A
5,travel_to_entity,"Agent_c73dd traveled to the Entity: -6 HP, +9 days.",anxious,cautious
5,travel_to_entity,"Agent_e957d traveled to the Entity: -12 HP, +7 days.",afraid,cautious
5,travel_to_entity,"Agent_56048 traveled to the Entity: -13 HP, +7 days.",afraid,curious
5,travel_to_entity,"Agent_6f7e7 traveled to the Entity: -12 HP, +5 days.",afraid,brave
5,travel_to_entity,"Agent_65c82 traveled to the Entity: -6 HP, +7 days.",anxious,brave
5,travel_to_entity,"Agent_248d7 traveled to the Entity: -15 HP, +7 days.",anxious,cautious
5,entity_defense,Entity killed Agent_56048 while defending herself.,N/A,N/A
6,dialogue,"Agent_7077c talks with Agent_18dda: ""Agent_7077c: ""I'm feeling anxious today, Agent_18dda. The Entity is getting closer and closer, and I'm worried about our survival.""""",anxious,empathetic
6,dialogue,"Agent_e7e63 talks with Agent_f5759: ""---""",afraid,empathetic
6,dialogue,"Agent_f5759 talks with Agent_e3fcf: ""Agent_f5759: I can't help but feel a sense of dread every time I see the old folks around town.
Agent_e3fcf: Same, but we can't give in to fear. We need to protect those who can't protect themselves.
Agent_f5759: I know, but it's hard not to feel like we're fighting a losing battle.
Agent_e3fcf: We're not alone. We have each other, and we'll find a way to survive this.
Agent_f5759: I hope so. I just don't know how much longer we can hold on.
Agent_""",afraid,brave
6,dialogue,"Agent_e3113 talks with Agent_c73dd: ""Agent_e3113: ""Agent c73dd, how are you doing today?""""",anxious,curious
6,dialogue,"Agent_18dda talks with Agent_e3113: ""---""",afraid,curious
6,dialogue,"Agent_cd3a2 talks with Agent_2ad13: ""Agent_cd3a2: (smiling) Hey Agent_2ad13! Hope you're doing well.
Agent_2ad13: (smiling back) Hello Agent_cd3a2! I'm doing well, thank you. How about you?
Agent_cd3a2: (thoughtfully) Honestly, I'm a bit scared. The Entity is getting closer and closer, and we have to figure out a way to survive.
Agent_2ad13: (nodding) Yeah, I understand. But we can't give up hope. We have to believe that there's a way to stop the Entity and save our town.""",afraid,curious
6,dialogue,"Agent_d1876 talks with Agent_f5759: ""---""",afraid,brave
6,dialogue,"Agent_a1e8a talks with Agent_814e6: ""Agent_a1e8a: ""Agent 814e6, what's your plan to survive the Entity?""""",anxious,aggressive
6,dialogue,"Agent_6f7e7 talks with Agent_1164b: ""---""",determined,brave
6,dialogue,"Agent_dc6cb talks with Agent_09019: ""---""",anxious,curious
6,dialogue,"Agent_de986 talks with Agent_248d7: ""Agent_de986: ""I'm worried. If the Entity continues on this path, soon we'll all be gone. What can we do?""""",anxious,brave
6,dialogue,"Agent_1164b talks with Agent_6f7e7: ""Agent_1164b: Hey Agent_6f7e7, I've been thinking a lot about the Entity lately. It's getting harder and harder to feel safe here.""",determined,curious
6,dialogue,"Agent_e3fcf talks with Agent_ef8fa: ""The Entity is coming""",anxious,empathetic
6,dialogue,"Agent_fcca1 talks with Agent_09019: ""---""",afraid,curious
6,dialogue,"Agent_cca20 talks with Agent_814e6: ""Agent_cca20: ""We've been told that we're at risk of erasure. The Entity is getting closer each year. I'm starting to fear for my own existence.""""",afraid,curious
6,dialogue,"Agent_007b6 talks with Agent_b0cdc: ""---""",anxious,cautious
6,dialogue,"Agent_b32fa talks with Agent_e7e63: ""---""",anxious,cautious
6,dialogue,"Agent_86853 talks with Agent_19c44: ""---""",anxious,brave
6,dialogue,"Agent_9953f talks with Agent_814e6: ""Agent_9953f: Hello Agent 814e6, I hope you're doing well.""",anxious,brave
6,dialogue,"Agent_5f8a9 talks with Agent_e3fcf: ""---""",determined,curious
6,dialogue,"Agent_b0cdc talks with Agent_ba26e: ""Agent_b0cdc: Hey Agent_ba26e, I was thinking about our current situation.""",anxious,aggressive
6,dialogue,"Agent_ac126 talks with Agent_bec91: ""---""",anxious,cautious
6,dialogue,"Agent_20512 talks with Agent_de986: ""---""",anxious,empathetic
6,dialogue,"Agent_09019 talks with Agent_cca20: ""Agent_09019: ""We've got to stop this Entity before it's too late. I don't want to be erased from existence.""""",determined,aggressive
6,dialogue,"Agent_742b1 talks with Agent_18dda: ""Agent_742b1: Hey Agent_18dda, how are you doing?
Agent_18dda: Honestly, I'm not sure. With the Entity coming, it feels like we're running out of time.
Agent_742b1: I know it's scary. But we have to keep hope alive. We need to come up with a plan to survive.
Agent_18dda: I'm with you. But what can we do? We're just two people.
Agent_742b1: We may not be able to change the world on our own, but we can change our own world. Let's""",anxious,curious
6,dialogue,"Agent_78e3e talks with Agent_e3fcf: ""---""",anxious,cautious
6,dialogue,"Agent_9e158 talks with Agent_de986: ""---""",afraid,empathetic
6,dialogue,"Agent_ba26e talks with Agent_cd3a2: ""---""",afraid,cautious
6,dialogue,"Agent_2ad13 talks with Agent_c44a6: ""Agent_2ad13: We need to find a way out of this town before it's too late. The Entity is getting closer, and we don't have much time left.""",afraid,brave
6,dialogue,"Agent_e957d talks with Agent_ef8fa: ""Agent_e957d: ""I've been thinking a lot lately. We can't just sit back and wait for the Entity to come for us. We have to do something.""""",anxious,cautious
6,dialogue,"Agent_19c44 talks with Agent_e3113: ""Agent_19c44: ""Hey, Agent_e3113, have you heard of the Entity?""""",anxious,empathetic
6,dialogue,"Agent_b3042 talks with Agent_65c82: ""---""",anxious,curious
6,dialogue,"Agent_c44a6 talks with Agent_20512: ""Agent_c44a6: Hey, 20512, have you noticed anything strange lately?""",afraid,cautious
6,dialogue,"Agent_bec91 talks with Agent_65c82: ""Agent_bec91: ""It's getting harder to keep track of the remaining population. Every year, one more person dies to the Entity.""""",afraid,empathetic
6,dialogue,"Agent_814e6 talks with Agent_18dda: ""---""",anxious,brave
6,dialogue,"Agent_ef8fa talks with Agent_a1e8a: ""Agent_ef8fa: ""I don't know what to do. I'm so scared.""
Agent_a1e8a: ""I know, I'm scared too. But we have to do something. We can't just sit here and watch as people die.""
Agent_ef8fa: ""I don't know what we can do. I don't even know how to fight.""
Agent_a1e8a: ""We don't have to fight. We just need to find a way to survive. We can try to gather information, find resources, and maybe even find a way to stop the Entity.""
Agent_ef8fa: ""But how""",afraid,curious
6,dialogue,"Agent_7d1ba talks with Agent_c44a6: ""Agent_7d1ba: ""Hey Agent_c44a6, have you heard anything about the Entity?""""",afraid,curious
6,dialogue,"Agent_248d7 talks with Agent_9953f: ""---""",afraid,cautious
6,dialogue,"Agent_65c82 talks with Agent_e957d: ""---""",anxious,brave
6,dialogue,"Agent_c73dd talks with Agent_742b1: ""Agent_c73dd: Hey 742b1. How's it going?
Agent_742b1: Hey c73dd. Honestly, not great. I'm really worried about the Entity.
Agent_c73dd: Yeah, me too. We can't let this thing get us. We have to be careful.
Agent_742b1: But how? We're just two agents. What can we do?
Agent_c73dd: We need to figure out a plan. Maybe we can gather some information and try to find a way to stop the Entity.
Agent_742b1: That""",anxious,cautious
6,training,"Agent_7077c trained in the village: +2 health, +1 attack, +1 defense.",determined,empathetic
6,training,"Agent_e7e63 trained in the village: +1 health, +0 attack, +1 defense.",determined,empathetic
6,rest,Agent_f5759 took time to rest and feels more at peace.,calm,brave
6,intent,Agent_18dda is preparing to fight the Entity.,afraid,curious
6,dialogue,"Agent_cd3a2 talks with Agent_86853: ""Agent_cd3a2: Hey, Agent_86853. I heard about the Entity. Is she really deadly?""",N/A,N/A
6,training,"Agent_d1876 trained in the village: +2 health, +1 attack, +1 defense.",determined,brave
6,training,"Agent_a1e8a trained in the village: +2 health, +0 attack, +1 defense.",determined,aggressive
6,rest,Agent_6f7e7 took time to rest and feels more at peace.,determined,brave
6,dialogue,"Agent_dc6cb talks with Agent_d1876: ""Agent_dc6cb: Hey, Agent_d1876. I've been thinking a lot about the Entity lately.""",N/A,N/A
6,intent,Agent_de986 is preparing to fight the Entity.,anxious,brave
6,rest,Agent_1164b took time to rest and feels more at peace.,determined,curious
6,rest,Agent_e3fcf took time to rest and feels more at peace.,calm,empathetic
6,intent,Agent_fcca1 is preparing to fight the Entity.,afraid,curious
6,dialogue,"Agent_b32fa talks with Agent_ac126: ""Agent_b32fa: ""I'm worried about the Entity. I've been seeing more and more people dying.""
Agent_ac126: ""I know. I've been counting. It's been two years since I last saw someone die.""
Agent_b32fa: ""I'm glad to hear that, but it's not enough. We need to find a way to stop the Entity.""
Agent_ac126: ""I know. I've been trying to figure out a way to do that. Maybe we can use our scientific knowledge to come up with a solution.""
Agent_b32fa: ""That's a""",N/A,N/A
6,rest,Agent_86853 took time to rest and feels more at peace.,calm,brave
6,intent,Agent_9953f is preparing to fight the Entity.,anxious,brave
6,rest,Agent_5f8a9 took time to rest and feels more at peace.,determined,curious
6,training,"Agent_b0cdc trained in the village: +1 health, +1 attack, +0 defense.",determined,aggressive
6,training,"Agent_ac126 trained in the village: +1 health, +1 attack, +1 defense.",determined,cautious
6,training,"Agent_09019 trained in the village: +1 health, +0 attack, +0 defense.",determined,aggressive
6,dialogue,"Agent_742b1 talks with Agent_007b6: ""---""",N/A,N/A
6,training,"Agent_78e3e trained in the village: +2 health, +1 attack, +0 defense.",determined,cautious
6,training,"Agent_9e158 trained in the village: +1 health, +1 attack, +1 defense.",determined,empathetic
6,training,"Agent_ba26e trained in the village: +2 health, +1 attack, +1 defense.",determined,cautious
6,dialogue,"Agent_2ad13 talks with Agent_cca20: ""Agent_2ad13: (brave) I'm afraid.""",N/A,N/A
6,training,"Agent_19c44 trained in the village: +1 health, +0 attack, +1 defense.",determined,empathetic
6,training,"Agent_b3042 trained in the village: +1 health, +1 attack, +1 defense.",determined,curious
6,training,"Agent_bec91 trained in the village: +1 health, +1 attack, +0 defense.",determined,empathetic
6,training,"Agent_814e6 trained in the village: +1 health, +1 attack, +1 defense.",determined,brave
6,training,"Agent_7d1ba trained in the village: +2 health, +0 attack, +0 defense.",determined,curious
6,training,"Agent_248d7 trained in the village: +1 health, +1 attack, +0 defense.",determined,cautious
6,training,"Agent_65c82 trained in the village: +1 health, +1 attack, +1 defense.",determined,brave
6,intent,Agent_c73dd is preparing to fight the Entity.,anxious,cautious
6,pregnancy,Agent_c73dd got pregnant from Agent_ef8fa.,N/A,N/A
6,entity_attack,Entity killed Agent_814e6 while defending herself.,N/A,N/A
6,travel_to_entity,"Agent_7077c traveled to the Entity: -8 HP, +6 days.",anxious,empathetic
6,travel_to_entity,"Agent_a1e8a traveled to the Entity: -13 HP, +6 days.",anxious,aggressive
6,travel_to_entity,"Agent_de986 traveled to the Entity: -15 HP, +9 days.",anxious,brave
6,travel_to_entity,"Agent_fcca1 traveled to the Entity: -11 HP, +6 days.",anxious,curious
6,travel_to_entity,"Agent_09019 traveled to the Entity: -12 HP, +10 days.",anxious,aggressive
6,travel_to_entity,"Agent_9e158 traveled to the Entity: -15 HP, +8 days.",afraid,empathetic
6,travel_to_entity,"Agent_ef8fa traveled to the Entity: -8 HP, +6 days.",anxious,curious
6,travel_to_entity,"Agent_c73dd traveled to the Entity: -9 HP, +8 days.",afraid,cautious
6,entity_defense,Entity killed Agent_ef8fa while defending herself.,N/A,N/A
7,dialogue,"Agent_5f8a9 talks with Agent_c73dd: ""---""",determined,curious
7,dialogue,"Agent_2ad13 talks with Agent_e3113: ""---""",determined,brave
7,dialogue,"Agent_e3fcf talks with Agent_fcca1: ""Agent_e3fcf: (anxiously) We must do something. The Entity is getting closer.
Agent_fcca1: (nodding) I know. But what can we do? We can't change the course of the Entity's actions.
Agent_e3fcf: (frustrated) But we can't just sit here and watch as more and more people are erased.
Agent_fcca1: (sympathetically) I understand your concern, but we must be realistic. There are no guarantees in life.
Agent_e3fcf: (determined) But we can't give up hope. We have to""",anxious,empathetic
7,dialogue,"Agent_b32fa talks with Agent_9e158: ""---""",anxious,cautious
7,dialogue,"Agent_20512 talks with Agent_a1e8a: ""Agent_20512: (looking around nervously) I can't believe it's already 20512. The Entity is getting closer and closer.
Agent_a1e8a: (nodding) I know, it's such a scary time. But we have each other, and that's what counts.
Agent_20512: (looking at their hands) But what if the Entity gets to us before we can do anything? What if we die?
Agent_a1e8a: (taking a deep breath) We won't let that happen. We'll find a way to survive.
Agent_2""",anxious,empathetic
7,dialogue,"Agent_e3113 talks with Agent_86853: ""Agent_e3113: ""Listen, Agent_86853, I heard something strange. A rumor that the Entity has a weakness. We should investigate.""""",determined,curious
7,dialogue,"Agent_19c44 talks with Agent_9953f: ""---""",determined,empathetic
7,dialogue,"Agent_9e158 talks with Agent_ba26e: ""---""",anxious,empathetic
7,dialogue,"Agent_a1e8a talks with Agent_65c82: ""Agent_65c82: ""What are we going to do? The Entity is getting closer and closer every year. We need to find a way to stop her.""""",afraid,aggressive
7,dialogue,"Agent_d1876 talks with Agent_18dda: ""Agent_d1876: Hey Agent_18dda, how's it going?
Agent_18dda: Honestly, not great. I've been getting more and more nervous lately.
Agent_d1876: I can understand that. The Entity is a real threat.
Agent_18dda: I know. But I have hope. I believe that if we keep working together, we can find a way to defeat her.
Agent_d1876: I share your optimism. We both have the same goal – survival.
Agent_18dda: Yes, and we are both scientists. We are in a better position to""",anxious,brave
7,dialogue,"Agent_f5759 talks with Agent_5f8a9: ""Agent_f5759: ""We are doomed. The Entity will kill us all soon. I am afraid.""
Agent_5f8a9: ""Don't be afraid. We must fight back.""
Agent_f5759: ""How? We have no weapons or skills. We are just soldiers.""
Agent_5f8a9: ""We have each other. We can work together to find a way out.""
Agent_f5759: ""But what if we fail? What if we can't escape the Entity?""
Agent_5f8a9: ""We won't fail. We will find a solution. We must""",afraid,brave
7,dialogue,"Agent_cca20 talks with Agent_d1876: ""Agent_cca20: I can't believe it. We're all gonna die.
Agent_d1876: We can't give up. We have to find a way to survive.
Agent_cca20: But what can we do? The Entity erases everyone who's 100 years old or more.
Agent_d1876: We can try to find out if there's any way to slow down the erasure process. Maybe we can find a way to delay it.
Agent_cca20: That's a good idea. But how do we find out?
Agent_d1876: We could try to""",afraid,curious
7,dialogue,"Agent_86853 talks with Agent_65c82: ""---""",afraid,brave
7,dialogue,"Agent_742b1 talks with Agent_d1876: ""---""",anxious,curious
7,dialogue,"Agent_de986 talks with Agent_007b6: ""---""",anxious,brave
7,dialogue,"Agent_c73dd talks with Agent_dc6cb: ""Agent_c73dd: ""I'm feeling so anxious today. I can't help but think about the Entity and how she's slowly erasing our existence. What are we supposed to do? We can't just sit around and wait for her to come for us.""""",anxious,cautious
7,dialogue,"Agent_cd3a2 talks with Agent_86853: ""---""",afraid,curious
7,dialogue,"Agent_9953f talks with Agent_19c44: ""Agent_9953f: Agent_19c44, I'm so glad you're here. With the Entity's threat, I don't know what we're going to do.
Agent_19c44: We'll figure it out together, Agent_9953f. We have time.
Agent_9953f: Time? It's getting harder to stay hopeful every day.
Agent_19c44: I know it is, Agent_9953f. But we have to be hopeful. We have to believe that we can survive this.
Agent_9953f: But""",hopeful,brave
7,dialogue,"Agent_7077c talks with Agent_20512: ""---""",anxious,empathetic
7,dialogue,"Agent_e7e63 talks with Agent_c73dd: ""Agent_e7e63: ""I'm so sorry to hear that the Entity is back again. I was worried about you, Agent_c73dd.""""",anxious,empathetic
7,dialogue,"Agent_b0cdc talks with Agent_bec91: ""Agent_b0cdc:
I have a bad feeling today. Something about the Entity is different.""",anxious,aggressive
7,dialogue,"Agent_1164b talks with Agent_20512: ""Agent_1164b: Hey, Agent_20512!""",anxious,curious
7,dialogue,"Agent_ac126 talks with Agent_20512: ""---""",anxious,cautious
7,dialogue,"Agent_007b6 talks with Agent_7d1ba: ""---""",determined,cautious
7,dialogue,"Agent_248d7 talks with Agent_cd3a2: ""---""",afraid,cautious
7,dialogue,"Agent_fcca1 talks with Agent_c44a6: ""---""",afraid,curious
7,dialogue,"Agent_e957d talks with Agent_78e3e: ""---""",afraid,cautious
7,dialogue,"Agent_78e3e talks with Agent_86853: ""Agent_78e3e: I don't know what to do anymore. I'm so scared of dying. I'm scared of the Entity.""",afraid,cautious
7,dialogue,"Agent_ba26e talks with Agent_6f7e7: ""Agent_ba26e: ""We have to leave immediately. The Entity is closing in.""
Agent_6f7e7: ""We can't just run away. We need to do something to stop her.""
Agent_ba26e: ""I know, but we don't have much time. We'll have to be strategic.""
Agent_6f7e7: ""What can we do? We're just two people.""
Agent_ba26e: ""We can gather resources, fortify our home, and come up with a plan. We need to be cautious, but we can't let fear hold us back.""
Agent_6f7""",hopeful,cautious
7,dialogue,"Agent_dc6cb talks with Agent_c44a6: ""---""",determined,curious
7,dialogue,"Agent_7d1ba talks with Agent_e957d: ""---""",anxious,curious
7,dialogue,"Agent_bec91 talks with Agent_7d1ba: ""Agent_bec91: Good morning. I am Agent_bec91. I trust you know who I am.
Agent_7d1ba: Of course, I do. I am Agent_7d1ba. And I know what you mean by the Entity.
Agent_bec91: Yes, I fear for our lives and the lives of everyone else in this town. We must find a way to stop the Entity.
Agent_7d1ba: I agree. The Entity has been erasing people for years now. It's only a matter of time before we are all gone.
Agent_bec91: We need to be strategic. We cannot just""",afraid,empathetic
7,dialogue,"Agent_b3042 talks with Agent_248d7: ""---""",anxious,curious
7,dialogue,"Agent_09019 talks with Agent_cd3a2: ""---""",afraid,aggressive
7,dialogue,"Agent_18dda talks with Agent_7d1ba: ""Agent_18dda:
""Hello, I'm Agent 18dda. I've been following your work and I'm really scared of the Entity. She's going to erase everyone over 100 years old, and it's already gotten up to 10012 people. We need to figure out how to survive.""""",afraid,curious
7,dialogue,"Agent_c44a6 talks with Agent_b3042: ""Agent_c44a6: ""Hey Agent_b3042, I was just thinking about our current situation. The Entity is becoming more aggressive, and with each passing year, the age threshold is decreasing. We can't afford to take any chances.""""",anxious,cautious
7,dialogue,"Agent_65c82 talks with Agent_c73dd: ""---""",anxious,brave
7,dialogue,"Agent_6f7e7 talks with Agent_de986: ""---""",anxious,brave
7,training,"Agent_2ad13 trained in the village: +2 health, +1 attack, +1 defense.",determined,brave
7,rest,Agent_e3fcf took time to rest and feels more at peace.,calm,empathetic
7,rest,Agent_b32fa took time to rest and feels more at peace.,calm,cautious
7,rest,Agent_e3113 took time to rest and feels more at peace.,determined,curious
7,training,"Agent_19c44 trained in the village: +1 health, +1 attack, +0 defense.",determined,empathetic
7,intent,Agent_9e158 is preparing to fight the Entity.,anxious,empathetic
7,training,"Agent_a1e8a trained in the village: +1 health, +0 attack, +1 defense.",determined,aggressive
7,training,"Agent_d1876 trained in the village: +1 health, +1 attack, +0 defense.",determined,brave
7,training,"Agent_f5759 trained in the village: +1 health, +0 attack, +1 defense.",determined,brave
7,rest,Agent_cca20 took time to rest and feels more at peace.,calm,curious
7,dialogue,"Agent_86853 talks with Agent_de986: ""Agent_86853: de986, have you ever heard of the Entity?
Agent_de986: Yes, I have heard of it. It erases everyone who is at least 100 years old.
Agent_86853: That's terrifying. I'm afraid I'll be erased soon.
Agent_de986: Me too. But we have to keep living and hope for something.
Agent_86853: I don't know what we can do.
Agent_de986: We can work together and find a way to survive. Maybe we can find a solution to the P""",N/A,N/A
7,rest,Agent_742b1 took time to rest and feels more at peace.,calm,curious
7,training,"Agent_de986 trained in the village: +1 health, +0 attack, +0 defense.",determined,brave
7,training,"Agent_c73dd trained in the village: +2 health, +1 attack, +0 defense.",determined,cautious
7,dialogue,"Agent_cd3a2 talks with Agent_e957d: ""Agent_cd3a2: ""I'm so scared, Agent. I don't know what to do. We have to stop the Entity before it's too late.""""",N/A,N/A
7,intent,Agent_9953f is preparing to fight the Entity.,hopeful,brave
7,training,"Agent_7077c trained in the village: +2 health, +1 attack, +0 defense.",determined,empathetic
7,training,"Agent_e7e63 trained in the village: +1 health, +0 attack, +0 defense.",determined,empathetic
7,training,"Agent_b0cdc trained in the village: +1 health, +0 attack, +0 defense.",determined,aggressive
7,rest,Agent_1164b took time to rest and feels more at peace.,calm,curious
7,training,"Agent_ac126 trained in the village: +2 health, +1 attack, +1 defense.",determined,cautious
7,dialogue,"Agent_007b6 talks with Agent_e7e63: ""---""",N/A,N/A
7,intent,Agent_248d7 is preparing to fight the Entity.,afraid,cautious
7,training,"Agent_fcca1 trained in the village: +1 health, +0 attack, +0 defense.",determined,curious
7,intent,Agent_e957d is preparing to fight the Entity.,afraid,cautious
7,training,"Agent_78e3e trained in the village: +2 health, +0 attack, +0 defense.",determined,cautious
7,dialogue,"Agent_ba26e talks with Agent_de986: ""---""",N/A,N/A
7,dialogue,"Agent_dc6cb talks with Agent_742b1: ""Agent_dc6cb: Agent_742b1, I'm scared. I don't know what we're going to do.
Agent_742b1: It's okay, Agent_dc6cb. We have to trust that the Entity won't come for us yet.
Agent_dc6cb: But what if she does? What if we're not lucky this time?
Agent_742b1: We'll be ready. We'll work together, and we'll come up with a plan.
Agent_dc6cb: What kind of plan?
Agent_742b1: We need to find a way""",N/A,N/A
