day,event,content,mental_state,personality
10,dialogue,"Agent_6f7e7 talks with Agent_b0cdc: ""Agent_6f7e7: ""I'm Agent_6f7e7 and I've been tracking the Entity. She's getting closer. I've heard she's going to target us next. We have to act now. Do you know anything about her?""""",afraid,brave
10,dialogue,"Agent_d1876 talks with Agent_86853: ""Agent_d1876: ""Well, Agent_86853, I can see that you're really anxious today. What's bothering you?""
Agent_86853: ""I'm worried about the Entity, Agent_d1876. She's getting closer to us every year. Last year, I had a bad feeling about this year. I'm really scared.""
Agent_d1876: ""I understand your concerns, but we can't let fear control us. We need to focus on our daily lives and keep living as normally as possible. We can't let the Entity take away our hope.""
Agent""",hopeful,brave
10,dialogue,"Agent_b0cdc talks with Agent_742b1: ""---""",determined,aggressive
10,dialogue,"Agent_e7e63 talks with Agent_b32fa: ""---""",afraid,empathetic
10,dialogue,"Agent_5f8a9 talks with Agent_a1e8a: ""Agent_5f8a9: (whispers) I heard that the Entity is coming this year.""",afraid,curious
10,dialogue,"Agent_65c82 talks with Agent_dc6cb: ""---""",hopeful,brave
10,dialogue,"Agent_b3042 talks with Agent_cca20: ""Agent_b3042: I don't know what to do anymore. The Entity is getting closer and closer, and I don't want to die.""",anxious,curious
10,intent,Agent_f5759 is preparing to fight the Entity.,anxious,brave
10,training,"Agent_2ad13 trained in the village: +2 health, +0 attack, +0 defense.",determined,brave
10,intent,Agent_20512 is preparing to fight the Entity.,afraid,empathetic
10,training,"Agent_7077c trained in the village: +1 health, +1 attack, +0 defense.",determined,empathetic
10,rest,Agent_1164b took time to rest and feels more at peace.,calm,curious
10,training,"Agent_e957d trained in the village: +1 health, +1 attack, +0 defense.",hopeful,cautious
10,intent,Agent_fcca1 is preparing to fight the Entity.,afraid,curious
10,intent,Agent_9e158 is preparing to fight the Entity.,afraid,empathetic
10,intent,Agent_86853 is preparing to fight the Entity.,hopeful,brave
10,training,"Agent_a1e8a trained in the village: +2 health, +0 attack, +1 defense.",determined,aggressive
10,intent,Agent_c73dd is preparing to fight the Entity.,determined,cautious
10,training,"Agent_19c44 trained in the village: +2 health, +1 attack, +1 defense.",determined,empathetic
10,rest,Agent_09019 took time to rest and feels more at peace.,calm,aggressive
10,training,"Agent_248d7 trained in the village: +1 health, +0 attack, +1 defense.",hopeful,cautious
10,intent,Agent_ba26e is preparing to fight the Entity.,afraid,cautious
10,rest,Agent_e3fcf took time to rest and feels more at peace.,calm,empathetic
10,dialogue,"Agent_dc6cb talks with Agent_6f7e7: ""---""",N/A,N/A
10,dialogue,"Agent_b32fa talks with Agent_e3fcf: ""---""",N/A,N/A
10,training,"Agent_ac126 trained in the village: +2 health, +0 attack, +1 defense.",determined,cautious
10,training,"Agent_18dda trained in the village: +1 health, +1 attack, +1 defense.",hopeful,curious
10,dialogue,"Agent_742b1 talks with Agent_ba26e: ""Agent_742b1: ""I'm Agent_742b1. I've been monitoring the Entity's movements for a while now. It's terrifying how fast it's erasing people.""""",N/A,N/A
10,training,"Agent_78e3e trained in the village: +1 health, +1 attack, +0 defense.",determined,cautious
10,dialogue,"Agent_e3113 talks with Agent_5f8a9: ""Agent_e3113:
""Hey Agent_5f8a9, it's good to see you again. What's up? You look a bit shaken.
""""",N/A,N/A
10,training,"Agent_bec91 trained in the village: +1 health, +0 attack, +1 defense.",determined,empathetic
10,intent,Agent_cca20 is preparing to fight the Entity.,anxious,curious
10,rest,Agent_6f7e7 took time to rest and feels more at peace.,calm,brave
10,training,"Agent_d1876 trained in the village: +1 health, +0 attack, +1 defense.",hopeful,brave
10,training,"Agent_b0cdc trained in the village: +2 health, +0 attack, +1 defense.",determined,aggressive
10,training,"Agent_e7e63 trained in the village: +1 health, +0 attack, +0 defense.",determined,empathetic
10,training,"Agent_b3042 trained in the village: +2 health, +0 attack, +0 defense.",determined,curious
10,entity_attack,Entity killed Agent_1164b while defending herself.,N/A,N/A
10,travel_to_entity,"Agent_f5759 traveled to the Entity: -14 HP, +10 days.",afraid,brave
10,travel_to_entity,"Agent_20512 traveled to the Entity: -9 HP, +6 days.",afraid,empathetic
10,travel_to_entity,"Agent_7077c traveled to the Entity: -8 HP, +10 days.",afraid,empathetic
10,travel_to_entity,"Agent_e957d traveled to the Entity: -13 HP, +9 days.",anxious,cautious
10,travel_to_entity,"Agent_fcca1 traveled to the Entity: -5 HP, +10 days.",anxious,curious
10,travel_to_entity,"Agent_ba26e traveled to the Entity: -7 HP, +9 days.",afraid,cautious
10,travel_to_entity,"Agent_cca20 traveled to the Entity: -11 HP, +10 days.",afraid,curious
10,travel_to_entity,"Agent_e7e63 traveled to the Entity: -14 HP, +10 days.",afraid,empathetic
10,travel_to_entity,"Agent_5f8a9 traveled to the Entity: -11 HP, +8 days.",anxious,curious
10,travel_to_entity,"Agent_b3042 traveled to the Entity: -5 HP, +9 days.",afraid,curious
10,entity_defense,Entity killed Agent_7077c while defending herself.,N/A,N/A
11,death_monolith,Agent_5f8a9 (90) died due to the Monolith.,anxious,curious
11,dialogue,"Agent_19c44 talks with Agent_742b1: ""Agent_742b1: ""You know, I'm just starting to worry about my survival. With every passing year, the Entity is getting closer to us. I don't know if we can keep running forever.""""",hopeful,empathetic
11,dialogue,"Agent_fcca1 talks with Agent_c73dd: ""The conversation should be as short and to the point as possible while still conveying the necessary information.""",determined,curious
11,dialogue,"Agent_6f7e7 talks with Agent_18dda: ""The conversation should be written in a simple and natural way, using short sentences, simple vocabulary, and avoid jargon.""",afraid,brave
11,dialogue,"Agent_78e3e talks with Agent_9e158: ""---""",afraid,cautious
11,dialogue,"Agent_18dda talks with Agent_bec91: ""Agent_18dda: Hey, I've been thinking about this Entity thing. I can't shake off this feeling of unease.""",anxious,curious
11,dialogue,"Agent_cca20 talks with Agent_f5759: ""Agent_cca20: I just heard about the Entity. Have you heard anything?""",anxious,curious
11,dialogue,"Agent_e957d talks with Agent_ba26e: ""---""",anxious,cautious
11,dialogue,"Agent_09019 talks with Agent_b3042: ""Agent_09019: ""Hey, B3042! How are you doing today?""""",hopeful,aggressive
11,dialogue,"Agent_ba26e talks with Agent_d1876: ""---""",anxious,cautious
11,dialogue,"Agent_742b1 talks with Agent_e7e63: ""---""",hopeful,curious
11,dialogue,"Agent_a1e8a talks with Agent_6f7e7: ""Agent_a1e8a: I’m so afraid, Agent_6f7e7. What if I die before I can help the town?""",afraid,aggressive
11,dialogue,"Agent_2ad13 talks with Agent_742b1: ""Agent_2ad13: ""We've got to do something, Agent_742b1. We can't keep running from the Entity.""
Agent_742b1: ""I know, Agent_2ad13. But what can we do? She's too powerful, and we're just a couple of old folks.""
Agent_2ad13: ""We may be old, but we're not helpless. We've got skills, knowledge, and experience that she doesn't have. We can use that to our advantage.""
Agent_742b1: ""That's true, but what if she finds out what we're""",determined,brave
11,dialogue,"Agent_248d7 talks with Agent_78e3e: ""---""",afraid,cautious
11,dialogue,"Agent_b3042 talks with Agent_20512: ""Agent_b3042: Hey Agent_20512, I hope you're doing well.""",hopeful,curious
11,dialogue,"Agent_e3fcf talks with Agent_20512: ""---""",hopeful,empathetic
11,dialogue,"Agent_20512 talks with Agent_86853: ""Agent_20512: Agent_86853, have you noticed anything unusual lately?""",hopeful,empathetic
11,dialogue,"Agent_bec91 talks with Agent_f5759: ""---""",anxious,empathetic
11,dialogue,"Agent_b0cdc talks with Agent_19c44: ""---""",hopeful,aggressive
11,dialogue,"Agent_86853 talks with Agent_d1876: ""---""",determined,brave
11,dialogue,"Agent_c73dd talks with Agent_09019: ""Agent_c73dd: Hey Agent_09019, I heard about the Entity. What are you doing?""",hopeful,cautious
11,dialogue,"Agent_65c82 talks with Agent_a1e8a: ""Agent_65c82: I'm so glad that we could meet. I was worried that we might never get the chance to talk.""",anxious,brave
11,dialogue,"Agent_dc6cb talks with Agent_86853: ""Agent_dc6cb:
""Hello Agent 86853. I heard about the Entity and her deadly power. She's taking away everyone who's at least 100 years old, and we're running out of time. I'm so scared. What are we going to do?""""",afraid,curious
11,dialogue,"Agent_f5759 talks with Agent_d1876: ""Agent_f5759: (deep voice) Hello Agent_d1876.
Agent_f5759: I know you're scared, but we need to be ready.
Agent_f5759: The Entity is coming for us.
Agent_f5759: We need to find a way to stop her before it's too late.
Agent_f5759: We'll do whatever it takes.
Agent_d1876: (nervously) I don't know if we can do this.
Agent_d1876: (voice trembling) We have to find a way to""",afraid,brave
11,dialogue,"Agent_d1876 talks with Agent_b3042: ""Agent_d1876: ""I'm afraid. The Entity is getting closer and closer. I don't know how much longer we can survive.""""",hopeful,brave
11,dialogue,"Agent_9e158 talks with Agent_19c44: ""---""",hopeful,empathetic
11,dialogue,"Agent_e3113 talks with Agent_f5759: ""---""",anxious,curious
11,dialogue,"Agent_b32fa talks with Agent_2ad13: ""Agent_b32fa: Good evening, Agent_2ad13. I must say I'm feeling rather anxious about the recent rise in Entity sightings.""",anxious,cautious
11,dialogue,"Agent_ac126 talks with Agent_9e158: ""---""",determined,cautious
11,dialogue,"Agent_e7e63 talks with Agent_d1876: ""---""",determined,empathetic
11,training,"Agent_19c44 trained in the village: +2 health, +0 attack, +0 defense.",hopeful,empathetic
11,rest,Agent_fcca1 took time to rest and feels more at peace.,determined,curious
11,rest,Agent_6f7e7 took time to rest and feels more at peace.,calm,brave
11,training,"Agent_78e3e trained in the village: +1 health, +0 attack, +1 defense.",determined,cautious
11,training,"Agent_18dda trained in the village: +1 health, +0 attack, +1 defense.",determined,curious
11,rest,Agent_cca20 took time to rest and feels more at peace.,calm,curious
11,rest,Agent_e957d took time to rest and feels more at peace.,calm,cautious
11,intent,Agent_09019 is preparing to fight the Entity.,hopeful,aggressive
11,training,"Agent_ba26e trained in the village: +1 health, +1 attack, +1 defense.",determined,cautious
11,dialogue,"Agent_742b1 talks with Agent_248d7: ""Agent_742b1: Hey Agent_248d7, I've been thinking about the Entity. It's getting harder to hide from her every day.
Agent_248d7: I know, Agent_742b1. I've been thinking about it too. I'm scared for myself and everyone else around me.
Agent_742b1: We have to be careful. The Entity is out there, waiting for her next victim. We need to be vigilant.
Agent_248d7: I agree. But it's hard to stay motivated when we know we're running out of time.""",N/A,N/A
11,training,"Agent_a1e8a trained in the village: +2 health, +1 attack, +0 defense.",determined,aggressive
11,training,"Agent_2ad13 trained in the village: +2 health, +0 attack, +1 defense.",determined,brave
11,training,"Agent_248d7 trained in the village: +2 health, +1 attack, +0 defense.",determined,cautious
11,intent,Agent_b3042 is preparing to fight the Entity.,hopeful,curious
11,rest,Agent_e3fcf took time to rest and feels more at peace.,hopeful,empathetic
11,training,"Agent_bec91 trained in the village: +1 health, +1 attack, +0 defense.",determined,empathetic
11,intent,Agent_b0cdc is preparing to fight the Entity.,hopeful,aggressive
11,rest,Agent_86853 took time to rest and feels more at peace.,determined,brave
11,intent,Agent_c73dd is preparing to fight the Entity.,hopeful,cautious
11,training,"Agent_65c82 trained in the village: +1 health, +1 attack, +1 defense.",determined,brave
11,rest,Agent_dc6cb took time to rest and feels more at peace.,calm,curious
11,intent,Agent_f5759 is preparing to fight the Entity.,afraid,brave
11,training,"Agent_d1876 trained in the village: +2 health, +0 attack, +0 defense.",hopeful,brave
11,intent,Agent_9e158 is preparing to fight the Entity.,hopeful,empathetic
11,rest,Agent_e3113 took time to rest and feels more at peace.,calm,curious
11,rest,Agent_b32fa took time to rest and feels more at peace.,calm,cautious
11,training,"Agent_ac126 trained in the village: +2 health, +1 attack, +0 defense.",determined,cautious
11,intent,Agent_e7e63 is preparing to fight the Entity.,determined,empathetic
11,entity_attack,Entity killed Agent_65c82 while defending herself.,N/A,N/A
11,travel_to_entity,"Agent_fcca1 traveled to the Entity: -5 HP, +7 days.",anxious,curious
11,travel_to_entity,"Agent_e957d traveled to the Entity: -5 HP, +8 days.",anxious,cautious
11,travel_to_entity,"Agent_742b1 traveled to the Entity: -14 HP, +10 days.",anxious,curious
11,travel_to_entity,"Agent_b3042 traveled to the Entity: -13 HP, +8 days.",afraid,curious
11,travel_to_entity,"Agent_f5759 traveled to the Entity: -12 HP, +7 days.",afraid,brave
11,travel_to_entity,"Agent_9e158 traveled to the Entity: -13 HP, +7 days.",anxious,empathetic
11,entity_defense,Entity killed Agent_f5759 while defending herself.,N/A,N/A
12,dialogue,"Agent_cca20 talks with Agent_b0cdc: ""Agent_cca20: Hey, have you seen anything weird lately?
Agent_b0cdc: Honestly, I've been seeing a lot of strange things lately. I think it's because of the Entity.
Agent_cca20: Yeah, I've been thinking the same thing. It's getting harder to keep up with the changes.
Agent_b0cdc: I know. It's like we're living in a dream that we can't wake up from.
Agent_cca20: That's a good point. We need to figure out a way to survive this.
Agent_b0cdc: I agree. We need to find""",anxious,curious
12,dialogue,"Agent_e3113 talks with Agent_cca20: ""Agent_e3113: Hey Agent_cca20, do you have any idea what we're facing?""",anxious,curious
12,dialogue,"Agent_09019 talks with Agent_cca20: ""Agent_09019: Hey, I've heard some rumors. The Entity is coming here soon.""",afraid,aggressive
12,dialogue,"Agent_248d7 talks with Agent_b32fa: ""Agent_248d7: I'm afraid of the Entity.""",afraid,cautious
12,dialogue,"Agent_b3042 talks with Agent_a1e8a: ""---""",hopeful,curious
12,dialogue,"Agent_9e158 talks with Agent_18dda: ""---""",afraid,empathetic
12,dialogue,"Agent_19c44 talks with Agent_cca20: ""---""",anxious,empathetic
12,dialogue,"Agent_e957d talks with Agent_b32fa: ""The conversation should not exceed 200 words.""",anxious,cautious
12,dialogue,"Agent_78e3e talks with Agent_9e158: ""---""",anxious,cautious
12,dialogue,"Agent_dc6cb talks with Agent_d1876: ""Agent_dc6cb: Hey Agent_d1876, are you okay?
Agent_d1876: I'm doing okay, but I'm really scared about the Entity.
Agent_dc6cb: Yeah, me too. But we can't give up. We have to keep fighting.
Agent_d1876: I know, but it's hard to be optimistic when so many people are dying.
Agent_dc6cb: It's true, but we have to focus on what we can do. We can't change the past, but we can try to protect ourselves and others.
Agent_d1876:""",afraid,curious
12,dialogue,"Agent_e7e63 talks with Agent_ac126: ""---""",hopeful,empathetic
12,dialogue,"Agent_b0cdc talks with Agent_a1e8a: ""---""",determined,aggressive
12,dialogue,"Agent_ac126 talks with Agent_d1876: ""---""",hopeful,cautious
12,dialogue,"Agent_c73dd talks with Agent_86853: ""Agent_c73dd: (sighs) I'm so scared. I don't know what's going to happen when the Entity turns 100.""",afraid,cautious
12,dialogue,"Agent_e3fcf talks with Agent_a1e8a: ""---""",determined,empathetic
12,dialogue,"Agent_86853 talks with Agent_ac126: ""---""",hopeful,brave
12,dialogue,"Agent_d1876 talks with Agent_ba26e: ""---""",determined,brave
12,dialogue,"Agent_18dda talks with Agent_b32fa: ""---""",determined,curious
12,dialogue,"Agent_742b1 talks with Agent_e3fcf: ""---""",hopeful,curious
12,dialogue,"Agent_bec91 talks with Agent_e3fcf: ""Agent_bec91: ""E3, I've been thinking. I can't help but feel a sense of hopelessness. With each passing day, the Entity is getting closer and closer to us. We don't know how much longer we have.""""",hopeful,empathetic
12,dialogue,"Agent_b32fa talks with Agent_20512: ""Agent_b32fa: ""I don't know what to do. I'm so afraid of the Entity. I don't want to die.""""",hopeful,cautious
12,dialogue,"Agent_2ad13 talks with Agent_dc6cb: ""---""",afraid,brave
12,dialogue,"Agent_6f7e7 talks with Agent_09019: ""The Entity is lurking in the town, and they're getting older.
Agent_6f7e7: ""I'm so afraid. I'm getting older and older each day.""
Agent_09019: ""I understand. We're all getting older. But we have to stay strong and keep fighting for our survival.""
Agent_6f7e7: ""I'm so scared. I don't know if I can do this. The Entity is coming closer and closer.""
Agent_09019: ""We don't know what the future holds. But we can't give up hope. We have to keep going, no""",afraid,brave
12,dialogue,"Agent_ba26e talks with Agent_742b1: ""---""",hopeful,cautious
12,dialogue,"Agent_a1e8a talks with Agent_19c44: ""Agent_a1e8a: I'm so glad you're here Agent_19c44. I've been feeling so hopeless lately.""",anxious,aggressive
12,dialogue,"Agent_fcca1 talks with Agent_742b1: ""Agent_fcca1: Hey Agent_742b1, I heard about the Entity. Have you seen or heard anything related to her?""",determined,curious
12,dialogue,"Agent_20512 talks with Agent_09019: ""Agent_20512: Hello there, Agent_09019. I hope you're well.
Agent_09019: Hello, Agent_20512. I'm doing the best I can under the circumstances. I'm worried. I've heard about the Entity.
Agent_20512: Yes, I have too. It's a scary thing, but we need to be vigilant and hopeful.
Agent_09019: How can we hope for the best when the Entity erases everyone who is 100 years old?
Agent_20512: We can""",anxious,empathetic
12,intent,Agent_cca20 is preparing to fight the Entity.,anxious,curious
12,training,"Agent_e3113 trained in the village: +2 health, +0 attack, +1 defense.",determined,curious
12,intent,Agent_09019 is preparing to fight the Entity.,afraid,aggressive
12,training,"Agent_248d7 trained in the village: +2 health, +1 attack, +0 defense.",determined,cautious
12,intent,Agent_b3042 is preparing to fight the Entity.,hopeful,curious
12,training,"Agent_9e158 trained in the village: +2 health, +0 attack, +0 defense.",determined,empathetic
12,training,"Agent_19c44 trained in the village: +2 health, +1 attack, +0 defense.",determined,empathetic
12,rest,Agent_e957d took time to rest and feels more at peace.,calm,cautious
12,training,"Agent_78e3e trained in the village: +2 health, +1 attack, +1 defense.",determined,cautious
12,rest,Agent_dc6cb took time to rest and feels more at peace.,calm,curious
12,training,"Agent_e7e63 trained in the village: +1 health, +1 attack, +1 defense.",hopeful,empathetic
12,training,"Agent_b0cdc trained in the village: +2 health, +1 attack, +1 defense.",determined,aggressive
12,training,"Agent_ac126 trained in the village: +2 health, +1 attack, +0 defense.",hopeful,cautious
12,intent,Agent_c73dd is preparing to fight the Entity.,afraid,cautious
12,rest,Agent_86853 took time to rest and feels more at peace.,hopeful,brave
12,training,"Agent_d1876 trained in the village: +2 health, +1 attack, +0 defense.",determined,brave
12,training,"Agent_18dda trained in the village: +1 health, +1 attack, +1 defense.",determined,curious
12,rest,Agent_742b1 took time to rest and feels more at peace.,hopeful,curious
12,training,"Agent_bec91 trained in the village: +2 health, +1 attack, +0 defense.",hopeful,empathetic
12,dialogue,"Agent_b32fa talks with Agent_6f7e7: ""---""",N/A,N/A
12,rest,Agent_2ad13 took time to rest and feels more at peace.,calm,brave
12,rest,Agent_6f7e7 took time to rest and feels more at peace.,calm,brave
12,intent,Agent_ba26e is preparing to fight the Entity.,hopeful,cautious
12,training,"Agent_a1e8a trained in the village: +1 health, +0 attack, +1 defense.",determined,aggressive
12,training,"Agent_fcca1 trained in the village: +1 health, +1 attack, +0 defense.",determined,curious
12,intent,Agent_20512 is preparing to fight the Entity.,anxious,empathetic
12,entity_attack,Entity killed Agent_c73dd while defending herself.,N/A,N/A
12,travel_to_entity,"Agent_cca20 traveled to the Entity: -15 HP, +5 days.",afraid,curious
12,travel_to_entity,"Agent_e3113 traveled to the Entity: -6 HP, +9 days.",afraid,curious
12,travel_to_entity,"Agent_09019 traveled to the Entity: -9 HP, +9 days.",afraid,aggressive
12,travel_to_entity,"Agent_19c44 traveled to the Entity: -9 HP, +10 days.",anxious,empathetic
12,travel_to_entity,"Agent_86853 traveled to the Entity: -6 HP, +8 days.",afraid,brave
12,travel_to_entity,"Agent_2ad13 traveled to the Entity: -9 HP, +8 days.",anxious,brave
12,entity_defense,Entity killed Agent_09019 while defending herself.,N/A,N/A
13,death_monolith,Agent_e7e63 (88) died due to the Monolith.,determined,empathetic
13,dialogue,"Agent_cca20 talks with Agent_bec91: ""Agent_cca20: ""I've been thinking about the Entity lately. I don't know how we're going to make it through this. It feels like our time is running out.""""",anxious,curious
13,dialogue,"Agent_ac126 talks with Agent_e3113: ""---""",hopeful,cautious
13,dialogue,"Agent_78e3e talks with Agent_86853: ""Agent_78e3e: ""Hey, have you heard of the Entity?""""",anxious,cautious
13,dialogue,"Agent_e3fcf talks with Agent_cca20: ""Agent_e3fcf: ""Hey Agent_cca20. I don't know what's going on, but it seems like everyone is getting older and disappearing one by one. It's so scary. I feel like we're running out of time. We need to find a way to survive this.""""",determined,empathetic
13,dialogue,"Agent_fcca1 talks with Agent_e3fcf: ""Agent_fcca1: Hi Agent_e3fcf, it's good to see you again.""",hopeful,curious
13,dialogue,"Agent_19c44 talks with Agent_fcca1: ""Agent_19c44:
Agent_fcca1, we have to be careful out there. I've seen too much lately.""",determined,empathetic
13,dialogue,"Agent_e957d talks with Agent_a1e8a: ""---""",anxious,cautious
13,dialogue,"Agent_dc6cb talks with Agent_248d7: ""---""",anxious,curious
13,dialogue,"Agent_6f7e7 talks with Agent_20512: ""Agent_6f7e7: ""So, Agent_20512, what's been going on lately? Anything new?""
Agent_20512: ""Not really, same old thing. The Entity is still erasing everyone over 100. I've been trying to find a way to stop her, but so far nothing's worked.""
Agent_6f7e7: ""I know how that feels. We've been trying to figure out a strategy to take her down. I think we need to focus on finding her weakness and exploiting it.""
Agent_20512: ""That's a good idea, but we don'""",anxious,brave
13,dialogue,"Agent_bec91 talks with Agent_6f7e7: ""Agent_bec91: ""6f, I'm worried about the Entity. Every year we lose more people to her. I hope we can find a way to stop her before it's too late.""""",anxious,empathetic
13,dialogue,"Agent_248d7 talks with Agent_b3042: ""Agent_248d7: What if we can't find a way out of here?
Agent_b3042: We have to keep trying. We can't give up hope.
Agent_248d7: But the Entity is getting closer every year.
Agent_b3042: That's why we need to be more vigilant. We have to find a way to protect ourselves and others.
Agent_248d7: I'm afraid for my own survival.
Agent_b3042: Me too. But we have each other. We can support each other through this.
Agent_248d7""",afraid,cautious
13,dialogue,"Agent_20512 talks with Agent_9e158: ""---""",anxious,empathetic
13,dialogue,"Agent_18dda talks with Agent_d1876: ""---""",anxious,curious
13,dialogue,"Agent_9e158 talks with Agent_e3113: ""---""",hopeful,empathetic
13,dialogue,"Agent_d1876 talks with Agent_b3042: ""---""",anxious,brave
13,dialogue,"Agent_742b1 talks with Agent_19c44: ""---""",anxious,curious
13,dialogue,"Agent_b3042 talks with Agent_2ad13: ""Their names are Agent_b3042 and Agent_2ad13.""",anxious,curious
13,dialogue,"Agent_ba26e talks with Agent_e3fcf: ""Agent_ba26e: ""I've been trying to find a way out of this place. But I can't seem to escape the Entity.""
Agent_e3fcf: ""I know what you mean. I've been trying to figure out a way to survive too. But it's getting harder every year.""
Agent_ba26e: ""I'm afraid. I don't know what I'll do when I turn 100. I don't want to be erased.""
Agent_e3fcf: ""I understand. I'm afraid too. But we have to keep going. We can't give up hope.""
Agent""",afraid,cautious
13,dialogue,"Agent_a1e8a talks with Agent_19c44: ""Agent_a1e8a: Hey, what's up? Do you know what's going on with the Entity?""",afraid,aggressive
13,dialogue,"Agent_e3113 talks with Agent_b3042: ""Agent_b3042: Hey Agent_e3113, how's it going?""",anxious,curious
13,dialogue,"Agent_2ad13 talks with Agent_fcca1: ""Agent_2ad13: (still trembling) ""I'm sorry, Agent_fcca1. I didn't mean to scare you earlier. I just wanted to make sure you understood the seriousness of the situation.""
Agent_fcca1: (nods) ""I know, Agent_2ad13. I just didn't want to be the one to tell you.""
Agent_2ad13: ""I understand. We're all in this together, right?""
Agent_fcca1: ""Absolutely.""
Agent_2ad13: ""So, what's our plan? What are we going to do to survive?""
Agent_f""",hopeful,brave
13,dialogue,"Agent_b0cdc talks with Agent_6f7e7: ""Agent_b0cdc: ""We need to come up with a plan to defeat the Entity. We can't just sit here and wait for it to kill us all.""""",anxious,aggressive
13,dialogue,"Agent_86853 talks with Agent_b0cdc: ""Agent_86853: Agent_b0cdc, how are you doing?
Agent_b0cdc: Honestly, Agent_86853, I am not doing well. I am constantly worried about the Entity.
Agent_86853: I understand, Agent_b0cdc. I am worried too. But we must not let fear control us.
Agent_b0cdc: That's true, Agent_86853. We must find a way to survive and protect ourselves from the Entity.
Agent_86853: I agree. We need to think strategically and come up with a plan to protect""",afraid,brave
