day,event,content,mental_state,personality
7,intent,Agent_7d1ba is preparing to fight the Entity.,anxious,curious
7,training,"Agent_bec91 trained in the village: +1 health, +1 attack, +1 defense.",determined,empathetic
7,intent,Agent_b3042 is preparing to fight the Entity.,anxious,curious
7,dialogue,"Agent_09019 talks with Agent_ac126: ""Agent_09019: Hey, Agent_ac126, I heard the Entity is coming again this year.
Agent_ac126: Yeah, I saw it on the news. This time, she's targeting everyone who's at least 90 years old.
Agent_09019: That's really bad, Agent_ac126. I'm afraid for my life.
Agent_ac126: Me too, Agent_09019. But we have to stay strong and keep fighting. We have to find a way to survive.
Agent_09019: I agree, Agent_ac1""",N/A,N/A
7,training,"Agent_18dda trained in the village: +2 health, +0 attack, +0 defense.",determined,curious
7,training,"Agent_c44a6 trained in the village: +1 health, +1 attack, +0 defense.",determined,cautious
7,rest,Agent_6f7e7 took time to rest and feels more at peace.,calm,brave
7,pregnancy,Agent_09019 got pregnant from Agent_20512.,N/A,N/A
7,entity_attack,Entity killed Agent_007b6 while defending herself.,N/A,N/A
7,travel_to_entity,"Agent_5f8a9 traveled to the Entity: -14 HP, +8 days.",anxious,curious
7,travel_to_entity,"Agent_9953f traveled to the Entity: -13 HP, +8 days.",anxious,brave
7,travel_to_entity,"Agent_7077c traveled to the Entity: -13 HP, +6 days.",anxious,empathetic
7,travel_to_entity,"Agent_bec91 traveled to the Entity: -5 HP, +8 days.",anxious,empathetic
7,entity_defense,Entity killed Agent_9953f while defending herself.,N/A,N/A
8,dialogue,"Agent_b3042 talks with Agent_d1876: ""---""",determined,curious
8,dialogue,"Agent_c73dd talks with Agent_ba26e: ""---""",anxious,cautious
8,dialogue,"Agent_248d7 talks with Agent_d1876: ""Agent_248d7: ""I'm still not sure if we can defeat the Entity. She's too powerful. She can erase anyone over a certain age, and each year the threshold gets lower. I fear that soon, no one will be safe.""""",afraid,cautious
8,dialogue,"Agent_9e158 talks with Agent_20512: ""Agent_9e158: ""Hello, Agent_20512. I hope you're well. I'm worried about the Entity.""""",hopeful,empathetic
8,dialogue,"Agent_1164b talks with Agent_9e158: ""Agent_1164b:
I don't know what we're going to do. The Entity is getting closer and closer, and there's nothing we can do to stop her.""",hopeful,curious
8,dialogue,"Agent_e7e63 talks with Agent_1164b: ""Agent_e7e63: Hello, Agent_1164b. How are you doing?
Agent_1164b: I'm doing well, Agent_e7e63. The town is safe, and we're doing our best to protect everyone.
Agent_e7e63: I know, but it's getting harder each year. The Entity is getting closer, and more people are dying.
Agent_1164b: Yes, it's a scary time for us. But we need to stay strong and keep working together.
Agent_e7e63: Absolutely. We need to find a way to stop the P""",hopeful,empathetic
8,dialogue,"Agent_de986 talks with Agent_c73dd: ""Agent_de986: ""I know we have to work together to survive. The Entity threatens us all, and we can't afford to let fear get the better of us.""""",afraid,brave
8,dialogue,"Agent_7d1ba talks with Agent_a1e8a: ""Agent_7d1ba: Hey, Agent_a1e8a, I was just thinking about the Entity. I'm scared.
Agent_a1e8a: I know it's scary, Agent_7d1ba. But we have to keep fighting.
Agent_7d1ba: I've been trying to figure out how we can survive. Maybe if we could find a way to slow down the Entity, we could buy ourselves some time.
Agent_a1e8a: That's a good idea. We should work together to find a solution.
Agent_7d1ba: I trust you, Agent_a1e8a.""",afraid,curious
8,dialogue,"Agent_b0cdc talks with Agent_ba26e: ""---""",anxious,aggressive
8,dialogue,"Agent_86853 talks with Agent_de986: ""Agent_86853: ""Hey there, Agent de986. How are you feeling today?""
Agent_de986: ""I'm doing well, Agent 86853. I'm scared to think about the Entity, but I'm also hopeful that we can find a way to stop her. How about you?""
Agent_86853: ""I'm feeling the same way. I'm scared for our town and the people we care about. But I'm also hopeful that we can find a way to protect ourselves and keep our lives safe. I think it's important to stay vigilant and be prepared for anything""",afraid,brave
8,dialogue,"Agent_e957d talks with Agent_b32fa: ""Agent_e957d: ""I can't believe it's been a year. I've seen so many people disappear, it's starting to take a toll on me.""""",anxious,cautious
8,dialogue,"Agent_7077c talks with Agent_19c44: ""---""",anxious,empathetic
8,dialogue,"Agent_a1e8a talks with Agent_20512: ""Agent_a1e8a: (anxiously) What do we do now? We're running out of time.
Agent_20512: (serious) We need to stay calm and come up with a plan.
Agent_a1e8a: (hesitant) But how can we protect ourselves from the Entity?
Agent_20512: (logical) We can't control what the Entity can do, but we can control how we react to it.
Agent_a1e8a: (anxiously) But what if we're not enough? What if we die?
Agent_20512""",anxious,aggressive
8,dialogue,"Agent_c44a6 talks with Agent_ba26e: ""Agent_c44a6: ""I can't sleep. I'm so scared. I keep thinking of what will happen if we can't stop the Entity.""""",afraid,cautious
8,dialogue,"Agent_6f7e7 talks with Agent_18dda: ""Agent_6f7e7: ""I'm so scared of the Entity. I feel like we're running out of time.""""",afraid,brave
8,dialogue,"Agent_20512 talks with Agent_c73dd: ""---""",determined,empathetic
8,dialogue,"Agent_2ad13 talks with Agent_c73dd: ""---""",anxious,brave
8,dialogue,"Agent_742b1 talks with Agent_5f8a9: ""---""",hopeful,curious
8,dialogue,"Agent_ac126 talks with Agent_cd3a2: ""---""",afraid,cautious
8,dialogue,"Agent_5f8a9 talks with Agent_19c44: ""---""",anxious,curious
8,dialogue,"Agent_09019 talks with Agent_b3042: ""Agent_09019: ""I'm afraid to leave my home. I don't want to die to the Entity.""""",afraid,aggressive
8,dialogue,"Agent_b32fa talks with Agent_dc6cb: ""Agent_b32fa: ""Agent_dc6cb, what if we're not the only ones? What if there are others like us? We need to find them, and fast.""""",determined,cautious
8,dialogue,"Agent_f5759 talks with Agent_742b1: ""Agent_f5759: We need to get out of here.
Agent_742b1: I know, but where?
Agent_f5759: Anywhere but here. We're going to die soon.
Agent_742b1: Yeah, we're all going to die eventually. It's just a matter of time.
Agent_f5759: I don't want to die. I want to live.
Agent_742b1: Me too. But we can't just run. We need a plan.
Agent_f5759: What kind of plan?
Agent_742b""",hopeful,brave
8,dialogue,"Agent_19c44 talks with Agent_742b1: ""Agent_19c44: Agent 742b1, do you think the Entity is getting closer?""",hopeful,empathetic
8,dialogue,"Agent_65c82 talks with Agent_ac126: ""---""",afraid,brave
8,dialogue,"Agent_dc6cb talks with Agent_f5759: ""---""",hopeful,curious
8,dialogue,"Agent_bec91 talks with Agent_f5759: ""Agent_bec91: Hey Agent_f5759, do you think we have enough time left to find a solution?""",hopeful,empathetic
8,dialogue,"Agent_78e3e talks with Agent_e7e63: ""---""",hopeful,cautious
8,dialogue,"Agent_e3fcf talks with Agent_09019: ""---""",anxious,empathetic
8,dialogue,"Agent_18dda talks with Agent_ac126: ""---""",afraid,curious
8,dialogue,"Agent_e3113 talks with Agent_86853: ""---""",anxious,curious
8,dialogue,"Agent_ba26e talks with Agent_78e3e: ""---""",hopeful,cautious
8,dialogue,"Agent_d1876 talks with Agent_b3042: ""Agent_d1876: Agent_b3042, we need to talk. I'm getting more and more afraid every day.
Agent_b3042: Me too, Agent_d1876. It's hard to think about anything else but the Entity.
Agent_d1876: I know. I've been trying to come up with a plan to protect myself, but I don't know where to start.
Agent_b3042: That's understandable. It's hard to think about survival when we're under such a constant threat.
Agent_d1876: But we have to""",afraid,brave
8,dialogue,"Agent_fcca1 talks with Agent_e957d: ""Agent_fcca1: ""Hey Agent_e957d, I'm Agent_fcca1. Have you heard anything about the Entity lately?""""",afraid,curious
8,dialogue,"Agent_cd3a2 talks with Agent_86853: ""---""",anxious,curious
8,dialogue,"Agent_cca20 talks with Agent_a1e8a: ""---""",anxious,curious
8,intent,Agent_b3042 is preparing to fight the Entity.,determined,curious
8,intent,Agent_c73dd is preparing to fight the Entity.,anxious,cautious
8,training,"Agent_248d7 trained in the village: +1 health, +0 attack, +0 defense.",determined,cautious
8,training,"Agent_9e158 trained in the village: +2 health, +1 attack, +1 defense.",hopeful,empathetic
8,rest,Agent_1164b took time to rest and feels more at peace.,hopeful,curious
8,training,"Agent_e7e63 trained in the village: +1 health, +0 attack, +1 defense.",hopeful,empathetic
8,training,"Agent_de986 trained in the village: +2 health, +1 attack, +0 defense.",determined,brave
8,training,"Agent_7d1ba trained in the village: +2 health, +0 attack, +0 defense.",determined,curious
8,rest,Agent_b0cdc took time to rest and feels more at peace.,calm,aggressive
8,training,"Agent_86853 trained in the village: +1 health, +0 attack, +0 defense.",determined,brave
8,intent,Agent_e957d is preparing to fight the Entity.,anxious,cautious
8,dialogue,"Agent_7077c talks with Agent_c44a6: ""---""",N/A,N/A
8,training,"Agent_a1e8a trained in the village: +2 health, +1 attack, +0 defense.",determined,aggressive
8,intent,Agent_c44a6 is preparing to fight the Entity.,afraid,cautious
8,rest,Agent_6f7e7 took time to rest and feels more at peace.,calm,brave
8,training,"Agent_20512 trained in the village: +2 health, +1 attack, +0 defense.",determined,empathetic
8,training,"Agent_2ad13 trained in the village: +2 health, +1 attack, +0 defense.",determined,brave
8,dialogue,"Agent_742b1 talks with Agent_2ad13: ""Agent_742b1: Hey Agent_2ad13, it's good to see you again. How are you feeling today?""",N/A,N/A
8,rest,Agent_ac126 took time to rest and feels more at peace.,calm,cautious
8,training,"Agent_5f8a9 trained in the village: +2 health, +0 attack, +1 defense.",determined,curious
8,intent,Agent_b32fa is preparing to fight the Entity.,determined,cautious
8,intent,Agent_f5759 is preparing to fight the Entity.,hopeful,brave
8,training,"Agent_19c44 trained in the village: +2 health, +0 attack, +1 defense.",hopeful,empathetic
8,intent,Agent_65c82 is preparing to fight the Entity.,afraid,brave
8,dialogue,"Agent_dc6cb talks with Agent_cd3a2: ""---""",N/A,N/A
8,dialogue,"Agent_bec91 talks with Agent_5f8a9: ""---""",N/A,N/A
8,intent,Agent_78e3e is preparing to fight the Entity.,hopeful,cautious
8,rest,Agent_e3fcf took time to rest and feels more at peace.,calm,empathetic
8,training,"Agent_18dda trained in the village: +2 health, +1 attack, +1 defense.",determined,curious
8,training,"Agent_ba26e trained in the village: +2 health, +0 attack, +0 defense.",hopeful,cautious
8,training,"Agent_d1876 trained in the village: +2 health, +0 attack, +0 defense.",determined,brave
8,intent,Agent_fcca1 is preparing to fight the Entity.,afraid,curious
8,rest,Agent_cd3a2 took time to rest and feels more at peace.,calm,curious
8,dialogue,"Agent_cca20 talks with Agent_742b1: ""Agent_cca20: ""Hey, Agent 742b1. I'm Agent_cca20. Have you heard anything about the Entity?""""",N/A,N/A
8,entity_attack,Entity killed Agent_c44a6 while defending herself.,N/A,N/A
8,travel_to_entity,"Agent_b3042 traveled to the Entity: -7 HP, +7 days.",anxious,curious
8,travel_to_entity,"Agent_7d1ba traveled to the Entity: -6 HP, +7 days.",anxious,curious
8,travel_to_entity,"Agent_86853 traveled to the Entity: -14 HP, +9 days.",afraid,brave
8,travel_to_entity,"Agent_a1e8a traveled to the Entity: -13 HP, +6 days.",anxious,aggressive
8,travel_to_entity,"Agent_65c82 traveled to the Entity: -12 HP, +7 days.",afraid,brave
8,travel_to_entity,"Agent_78e3e traveled to the Entity: -6 HP, +5 days.",afraid,cautious
8,travel_to_entity,"Agent_cd3a2 traveled to the Entity: -8 HP, +5 days.",afraid,curious
8,entity_defense,Entity killed Agent_cd3a2 while defending herself.,N/A,N/A
9,dialogue,"Agent_86853 talks with Agent_bec91: ""Agent_86853: ""I'm glad we're both here, Agent. It's been a while since we've seen each other. I was worried.""""",anxious,brave
9,dialogue,"Agent_e3fcf talks with Agent_78e3e: ""---""",anxious,empathetic
9,dialogue,"Agent_742b1 talks with Agent_d1876: ""Agent_742b1: ""I heard some rumors about the Entity. Do you think she's after us?""""",hopeful,curious
9,dialogue,"Agent_f5759 talks with Agent_e7e63: ""---""",anxious,brave
9,dialogue,"Agent_bec91 talks with Agent_b0cdc: ""Agent_bec91: ""Hello Agent_b0cdc. How are you?""""",anxious,empathetic
9,dialogue,"Agent_e3113 talks with Agent_09019: ""Agent_e3113: ""Hey, Agent 09019. I'm Agent_e3113. Nice to meet you.""""",hopeful,curious
9,dialogue,"Agent_a1e8a talks with Agent_bec91: ""---""",anxious,aggressive
9,dialogue,"Agent_b32fa talks with Agent_742b1: ""Agent_b32fa: ""I can't shake this feeling of dread. What if the Entity comes for us?""""",hopeful,cautious
9,dialogue,"Agent_cca20 talks with Agent_ac126: ""Agent_cca20: ""Hello, Agent ac126. I've been trying to reach you for days. What happened to you?""""",hopeful,curious
9,dialogue,"Agent_e957d talks with Agent_20512: ""---""",anxious,cautious
9,dialogue,"Agent_1164b talks with Agent_ac126: ""---""",hopeful,curious
9,dialogue,"Agent_ba26e talks with Agent_bec91: ""Agent_ba26e: ""Hey, Agent_bec91. I know it's been tough lately. How are you holding up?""""",anxious,cautious
9,dialogue,"Agent_19c44 talks with Agent_ba26e: ""Agent_19c44: We have to get out of here before it's too late.""",afraid,empathetic
9,dialogue,"Agent_78e3e talks with Agent_7077c: ""Agent_7077c: ""Agent_78e3e, I'm really scared of the Entity. I don't know what to do if I'm going to die.""""",hopeful,cautious
9,dialogue,"Agent_d1876 talks with Agent_86853: ""Agent_d1876: Hey Agent_86853, we're both under the same threat, right?""",anxious,brave
9,dialogue,"Agent_7d1ba talks with Agent_09019: ""Agent_7d1ba: ""We have to figure out how to stop her. I'm afraid she'll erase us all one day.""
Agent_09019: ""I know, but we don't know where she is or what she looks like. We're just two agents in a small town.""
Agent_7d1ba: ""But we have to do something. We can't just sit here and watch as everyone dies.""
Agent_09019: ""I agree. We need to come up with a plan, something that we can both work on. We need to be smart about this.""
Agent_7d1ba: ""What if we""",hopeful,curious
9,dialogue,"Agent_b3042 talks with Agent_e3113: ""Agent_b3042: ""E3113, I've been thinking a lot about the Entity lately. I don't know how much time we have left.""
Agent_e3113: ""B3042, we both know the Entity doesn't care about us. We are just numbers in her eyes.""
Agent_b3042: ""That's true, but it's hard to accept that we're going to die soon. I've been farming for so long, and I have so much to accomplish.""
Agent_e3113: ""I understand your feelings, B3042. But we""",determined,curious
9,dialogue,"Agent_09019 talks with Agent_19c44: ""Agent_09019:""",anxious,aggressive
9,dialogue,"Agent_c73dd talks with Agent_18dda: ""---""",afraid,cautious
9,dialogue,"Agent_ac126 talks with Agent_d1876: ""A: ""Dear D1876, how's your day going? Do you feel safe from the Entity?""""",anxious,cautious
9,dialogue,"Agent_18dda talks with Agent_bec91: ""Agent_18dda: I hope you're well, Agent_bec91. I've been thinking a lot about our situation lately.
Agent_bec91: As have I, Agent_18dda. I'm glad we have each other as allies.
Agent_18dda: Yes, it's comforting to know that we're not alone. We've been fighting the Entity for a long time now.
Agent_bec91: That's true. But we must be careful, the Entity is getting closer each year.
Agent_18dda: I know, but I have a plan. I think we should work""",anxious,curious
9,dialogue,"Agent_5f8a9 talks with Agent_cca20: ""---""",hopeful,curious
9,dialogue,"Agent_b0cdc talks with Agent_e7e63: ""---""",afraid,aggressive
9,dialogue,"Agent_248d7 talks with Agent_09019: ""---""",afraid,cautious
9,dialogue,"Agent_fcca1 talks with Agent_09019: ""---""",determined,curious
9,dialogue,"Agent_e7e63 talks with Agent_ac126: ""---""",determined,empathetic
9,dialogue,"Agent_20512 talks with Agent_ac126: ""Agent_20512: (anxiously) ""I'm worried, Agent. The Entity is getting closer, and there's nothing we can do to stop it. What do we do now?""""",anxious,empathetic
9,dialogue,"Agent_7077c talks with Agent_248d7: ""---""",anxious,empathetic
9,dialogue,"Agent_dc6cb talks with Agent_2ad13: ""Agent_dc6cb: Hey Agent_2ad13, how are you doing?
Agent_2ad13: I'm doing okay, I've been thinking a lot about what we can do to stop the Entity.
Agent_dc6cb: Yeah, me too. I'm just so anxious about this all. What if we don't find a way to stop her before she reaches us?
Agent_2ad13: I know it's scary, but we have to keep thinking logically and strategically. We have to find a way to survive.
Agent_dc6cb: I just don't know what to do. I feel so helpless.""",hopeful,curious
9,dialogue,"Agent_6f7e7 talks with Agent_e7e63: ""---""",hopeful,brave
9,dialogue,"Agent_de986 talks with Agent_248d7: ""Agent_de986:
""I've been thinking a lot about the Entity lately. I'm scared to say this out loud, but I think we need to leave town. I don't want to be anywhere near her.""""",afraid,brave
9,dialogue,"Agent_9e158 talks with Agent_7d1ba: ""---""",hopeful,empathetic
9,dialogue,"Agent_2ad13 talks with Agent_6f7e7: ""---""",hopeful,brave
9,dialogue,"Agent_65c82 talks with Agent_7d1ba: ""Agent_65c82:
I'm scared, Agent_7d1ba. I don't know what we're going to do if we can't stop the Entity.""",hopeful,brave
9,intent,Agent_86853 is preparing to fight the Entity.,anxious,brave
9,rest,Agent_e3fcf took time to rest and feels more at peace.,calm,empathetic
9,dialogue,"Agent_742b1 talks with Agent_fcca1: ""Agent_742b1: Hey Agent_fcca1, how's it going?
Agent_fcca1: Honestly, not great. I'm worried about the Entity. She's getting closer and closer to us.
Agent_742b1: I know, it's scary. But we have to stay hopeful. There must be a way to stop her.
Agent_fcca1: I hope so too. But I can't shake this feeling of dread.
Agent_742b1: It's understandable. But we can't let fear control us. We have to focus on what we can do right now.
Agent_""",N/A,N/A
9,rest,Agent_f5759 took time to rest and feels more at peace.,calm,brave
9,intent,Agent_bec91 is preparing to fight the Entity.,anxious,empathetic
9,intent,Agent_e3113 is preparing to fight the Entity.,hopeful,curious
9,training,"Agent_a1e8a trained in the village: +1 health, +1 attack, +1 defense.",determined,aggressive
9,dialogue,"Agent_b32fa talks with Agent_e3113: ""---""",N/A,N/A
9,dialogue,"Agent_cca20 talks with Agent_9e158: ""---""",N/A,N/A
9,rest,Agent_1164b took time to rest and feels more at peace.,hopeful,curious
9,intent,Agent_ba26e is preparing to fight the Entity.,anxious,cautious
9,intent,Agent_19c44 is preparing to fight the Entity.,afraid,empathetic
9,training,"Agent_78e3e trained in the village: +2 health, +0 attack, +1 defense.",hopeful,cautious
9,training,"Agent_d1876 trained in the village: +1 health, +1 attack, +1 defense.",determined,brave
9,intent,Agent_7d1ba is preparing to fight the Entity.,hopeful,curious
9,intent,Agent_b3042 is preparing to fight the Entity.,determined,curious
9,rest,Agent_09019 took time to rest and feels more at peace.,calm,aggressive
9,intent,Agent_c73dd is preparing to fight the Entity.,afraid,cautious
9,training,"Agent_ac126 trained in the village: +2 health, +1 attack, +0 defense.",determined,cautious
9,training,"Agent_18dda trained in the village: +2 health, +1 attack, +1 defense.",determined,curious
9,training,"Agent_b0cdc trained in the village: +1 health, +1 attack, +1 defense.",determined,aggressive
9,training,"Agent_248d7 trained in the village: +2 health, +1 attack, +0 defense.",determined,cautious
9,intent,Agent_fcca1 is preparing to fight the Entity.,determined,curious
9,dialogue,"Agent_e7e63 talks with Agent_65c82: ""Agent_e7e63: ""I'm glad we found each other. We're running out of time.""
Agent_65c82: ""I know, I'm terrified of what's coming. The Entity is relentless.""
Agent_e7e63: ""We need to find a way to stop her. We can't just sit here and wait for her to come for us.""
Agent_65c82: ""I agree. But how can we do that? She's so powerful.""
Agent_e7e63: ""We need to think outside the box. We can't let fear control us.""
Agent_""",N/A,N/A
9,training,"Agent_7077c trained in the village: +2 health, +0 attack, +1 defense.",determined,empathetic
9,intent,Agent_dc6cb is preparing to fight the Entity.,hopeful,curious
9,rest,Agent_6f7e7 took time to rest and feels more at peace.,hopeful,brave
9,training,"Agent_de986 trained in the village: +1 health, +0 attack, +1 defense.",determined,brave
9,intent,Agent_9e158 is preparing to fight the Entity.,hopeful,empathetic
9,training,"Agent_2ad13 trained in the village: +1 health, +1 attack, +0 defense.",hopeful,brave
9,rest,Agent_65c82 took time to rest and feels more at peace.,hopeful,brave
9,pregnancy,Agent_b0cdc got pregnant from Agent_7d1ba.,N/A,N/A
9,entity_attack,Entity killed Agent_de986 while defending herself.,N/A,N/A
9,travel_to_entity,"Agent_86853 traveled to the Entity: -7 HP, +5 days.",anxious,brave
9,travel_to_entity,"Agent_b32fa traveled to the Entity: -9 HP, +7 days.",afraid,cautious
9,travel_to_entity,"Agent_19c44 traveled to the Entity: -13 HP, +10 days.",afraid,empathetic
9,travel_to_entity,"Agent_7d1ba traveled to the Entity: -11 HP, +6 days.",afraid,curious
9,travel_to_entity,"Agent_c73dd traveled to the Entity: -6 HP, +10 days.",anxious,cautious
9,travel_to_entity,"Agent_18dda traveled to the Entity: -14 HP, +5 days.",afraid,curious
9,travel_to_entity,"Agent_65c82 traveled to the Entity: -12 HP, +8 days.",anxious,brave
9,entity_defense,Entity killed Agent_7d1ba while defending herself.,N/A,N/A
10,dialogue,"Agent_f5759 talks with Agent_1164b: ""Agent_f5759: ""Well, the Entity is coming. We have to be ready. I'm worried about you.""""",anxious,brave
10,dialogue,"Agent_2ad13 talks with Agent_fcca1: ""---""",determined,brave
10,dialogue,"Agent_20512 talks with Agent_78e3e: ""Agent_20512: ""We need to come up with a plan, Agent. The Entity is getting closer. I'm so scared.""""",afraid,empathetic
10,dialogue,"Agent_7077c talks with Agent_e957d: ""Agent_7077c: ""I'm so anxious about the Entity. I can't help but think about how many people have already died. I don't know what to do.""""",anxious,empathetic
10,dialogue,"Agent_1164b talks with Agent_7077c: ""Agent_1164b: I heard the Entity is coming closer. We have to find a way to survive.""",afraid,curious
10,dialogue,"Agent_e957d talks with Agent_dc6cb: ""Agent_e957d: ""I'm afraid the Entity is coming for us too. We need to find a way to survive.""""",hopeful,cautious
10,dialogue,"Agent_fcca1 talks with Agent_2ad13: ""Agent_fcca1: Hey, Agent_2ad13. I'm really scared right now.
Agent_2ad13: I know it's tough, but we need to stay strong. We can't let the Entity win.
Agent_fcca1: I don't know if we can do it. The town is getting smaller and smaller.
Agent_2ad13: We can't give up. We have each other. We need to come up with a plan.
Agent_fcca1: I don't know what we can do. The Entity seems too powerful.
Agent_2ad13: We can't let fear""",afraid,curious
10,dialogue,"Agent_9e158 talks with Agent_19c44: ""---""",afraid,empathetic
10,dialogue,"Agent_86853 talks with Agent_dc6cb: ""---""",hopeful,brave
10,dialogue,"Agent_a1e8a talks with Agent_fcca1: ""Agent_a1e8a: ""Hey Fcca1, we're at a critical juncture. The Entity is getting closer and closer, and we need to come up with a plan.""""",anxious,aggressive
10,dialogue,"Agent_c73dd talks with Agent_e7e63: ""Agent_c73dd: Hey Agent_e7e63, how are you holding up?""",determined,cautious
10,dialogue,"Agent_19c44 talks with Agent_65c82: ""---""",anxious,empathetic
10,dialogue,"Agent_09019 talks with Agent_2ad13: ""Agent_09019: Agent_2ad13, have you heard about the Entity?""",afraid,aggressive
10,dialogue,"Agent_248d7 talks with Agent_86853: ""---""",hopeful,cautious
10,dialogue,"Agent_ba26e talks with Agent_e3113: ""Agent_ba26e: Hi Agent_e3113, how are you doing?
Agent_e3113: I'm doing fine, but the Entity keeps me awake at night. I fear for my survival.
Agent_ba26e: I know how you feel. I've been having the same nightmares. But we have to keep going.
Agent_e3113: That's true, but I'm not sure how much longer we can keep this up.
Agent_ba26e: We have to find a way to survive. Maybe we should try to gather more resources, like food and water, before the Entity""",afraid,cautious
10,dialogue,"Agent_e3fcf talks with Agent_c73dd: ""---""",afraid,empathetic
10,dialogue,"Agent_dc6cb talks with Agent_2ad13: ""---""",hopeful,curious
10,dialogue,"Agent_b32fa talks with Agent_f5759: ""Agent_b32fa: ""I can't believe it's happening.""""",afraid,cautious
10,dialogue,"Agent_ac126 talks with Agent_e3113: ""---""",anxious,cautious
10,dialogue,"Agent_18dda talks with Agent_b0cdc: ""---""",hopeful,curious
10,dialogue,"Agent_742b1 talks with Agent_f5759: ""Agent_742b1: I am afraid. Every day I fear for my own existence.
Agent_f5759: Me too. But we must not give up hope. We need to find a way to survive.
Agent_742b1: I know. But how? We are just two scientists.
Agent_f5759: We are not alone. We have each other. We can work together.
Agent_742b1: But what if we fail? What if we are not enough?
Agent_f5759: We must try. We cannot give up. We must find a way to protect ourselves and others.
Agent_7""",afraid,curious
10,dialogue,"Agent_78e3e talks with Agent_a1e8a: ""---""",determined,cautious
10,dialogue,"Agent_e3113 talks with Agent_d1876: ""---""",determined,curious
10,dialogue,"Agent_bec91 talks with Agent_ba26e: ""---""",afraid,empathetic
10,dialogue,"Agent_cca20 talks with Agent_2ad13: ""Agent_cca20:
I've been thinking... You know, I've been thinking a lot lately. I'm getting worried.""",anxious,curious
